index,published,keyword,domain,language,valid,title,description,url,image,archive,content,quote,de,en,la,added
eb8328e4be85d7aef4ca243f39dfe244,2026-04-13T16:43:55Z,'snow',www.rte.ie,en,0.7,President Snow issues threat in new Hunger Games trailer,Ralph Fiennes issues a deadly threat as President Coriolanus Snow in the first trailer for the new Hunger Games prequel.,https://www.rte.ie/entertainment/2026/0413/1568031-president-snow-issues-threat-in-new-hunger-games-trailer/,https://www.rte.ie/images/0024363b-1600.jpg,,"Ralph Fiennes issues a deadly threat as President Coriolanus Snow in the first trailer for the new Hunger Games prequel.
The Conclave actor stars as the villain in the film adaptation of the fifth b… [+2264 chars]",,Präsident Snow äußert im neuen Trailer zu den Tribute von Panem eine Drohung. Ralph Fiennes spricht als Präsident Coriolanus Snow im ersten Trailer zum neuen Prequel zu den Tribute von Panem eine tödliche Drohung aus.,President Snow issues threat in new Hunger Games trailer. Ralph Fiennes issues a deadly threat as President Coriolanus Snow in the first trailer for the new Hunger Games prequel.,Praeses Nivis exit in novas Fames Ludi sex minas. Ralph Fiennes minas funestas exit ut Praeses Coriolanus Nivis in primo trailer pro novis Ludis Fames prequel.,2026-04-14 19:51:21+00:00
20fd820b2dafe9cf6eac2dff17b5be56,2026-04-13T17:30:09Z,'snow',www.saastr.com,en,0.7,Come Join Us at the 2026 SaaStr AI CMO Summit on May 14th — Our 4th — with Snowflake CMO Denise Persson and 150+ of the Top B2B Marketing Leaders,"We’re doing it again. For the 4th year running, we’re hosting the SaaStr AI CMO Summit as part of SaaStr AI Annual 2026 — a half-day deep dive exclusively for the best marketers and GTM executives operating at the cutting edge of AI + B2B. And this year, we’r…",https://www.saastr.com/come-join-us-at-the-2026-saastr-ai-cmo-summit-our-4th-with-snowflake-cmo-denise-persson-and-150-of-the-top-b2b-marketing-leaders/,https://i0.wp.com/www.saastr.com/wp-content/uploads/2026/04/Screenshot-2026-04-13-at-8.51.17-AM-scaled.png?fit=1000%2C952&quality=70&ssl=1,,"We’re doing it again. For the 4th year running, we’re hosting the SaaStr AI CMO Summit as part of SaaStr AI Annual 2026 a half-day deep dive exclusively for the best marketers and GTM executives oper… [+7483 chars]",,"Besuchen Sie uns am 14. Mai – unserem 4. – beim SaaStr AI CMO Summit 2026 mit Snowflake CMO Denise Persson und über 150 der besten B2B-Marketingleiter. Wir machen es wieder. Zum vierten Mal in Folge veranstalten wir im Rahmen des SaaStr AI Annual 2026 den SaaStr AI CMO Summit – einen halbtägigen Deep Dive exklusiv für die besten Vermarkter und GTM-Führungskräfte, die auf dem neuesten Stand der KI + B2B tätig sind. Und dieses Jahr sind wir…","Come Join Us at the 2026 SaaStr AI CMO Summit on May 14th — Our 4th — with Snowflake CMO Denise Persson and 150+ of the Top B2B Marketing Leaders. We’re doing it again. For the 4th year running, we’re hosting the SaaStr AI CMO Summit as part of SaaStr AI Annual 2026 — a half-day deep dive exclusively for the best marketers and GTM executives operating at the cutting edge of AI + B2B. And this year, we’r…","Veni ad nos ad 2026 SaaStr AI CMO culmen die 14 Maii — Noster 4th — cum Snowflake CMO Denise Persson et 150+ Top B2B Duces Marketing. Iterum facimus. Ad quartum annum currentem, SaaStr AI CMO Summit partem SaaStr AI Annuum 2026 obsidemus — dimidium diem altum solum petunt pro optimis mercatibus et GTM executivis operantibus in aciei AI + B2B. Hoc anno, nos...",2026-04-14 19:51:21+00:00
07e942a12368a8a7ebd61c788356996f,2026-04-13T17:32:11Z,'snow',economictimes.indiatimes.com,en,0.7,Will Haymitch survive the Second Quarter Quell? Sunrise on the Reaping trailer reveals all,A new trailer for Sunrise on the Reaping reveals Haymitch Abernathy's fight in the Second Quarter Quell. He is selected as a tribute for the deadly games. President Snow issues a warning. The games feature double the tributes. Familiar faces like Effie Trinke…,https://economictimes.indiatimes.com/news/international/us/will-haymitch-survive-the-second-quarter-quell-sunrise-on-the-reaping-trailer-reveals-all/articleshow/130242467.cms,"https://img.etimg.com/thumb/msid-130242771,width-1200,height-630,imgsize-72640,overlay-economictimes/articleshow.jpg",,"The Hunger Games universe is heading back to District 12, and this time the spotlight is on a young Haymitch Abernathy. The newly released trailer for Sunrise on the Reaping offers an intense first l… [+2437 chars]",,Wird Haymitch den Quell im zweiten Quartal überleben? Der Trailer zu „Sunrise on the Reaping“ verrät alles. Ein neuer Trailer zu Sunrise on the Reaping enthüllt Haymitch Abernathys Kampf im Second Quarter Quell. Er wird als Hommage an die tödlichen Spiele ausgewählt. Präsident Snow spricht eine Warnung aus. Bei den Spielen gibt es doppelt so viele Ehrungen. Bekannte Gesichter wie Effie Trinke…,Will Haymitch survive the Second Quarter Quell? Sunrise on the Reaping trailer reveals all. A new trailer for Sunrise on the Reaping reveals Haymitch Abernathy's fight in the Second Quarter Quell. He is selected as a tribute for the deadly games. President Snow issues a warning. The games feature double the tributes. Familiar faces like Effie Trinke…,Numquid Haymitch superstes erit Secundam Quartam Quell? Ortus in metendo sex aperit omnia. Novum trailer pro Ortus in metendo Haymitch pugnam Abernathy in Secunda Quarta Quell indicat. Electus est in ludi funestos tributum. Praeses Nivis admonitionem procedit. Ludi pluma duplicantur tributa. Nota facies sicut Effie Trinke…,2026-04-14 19:51:21+00:00
5e014b3989f403d425b64e2e849f2184,2026-04-13T19:12:00Z,'snow',www.globenewswire.com,en,0.7,"SNOW's Generic Risk Warnings Allegedly Failed To Disclose Known Headwinds — Levi & Korsinsky, LLP",Disclosure Under Scrutiny: Were Snowflake's Risk Warnings Adequate? Disclosure Under Scrutiny: Were Snowflake's Risk Warnings Adequate?,https://www.globenewswire.com/news-release/2026/04/13/3272851/3080/en/SNOW-s-Generic-Risk-Warnings-Allegedly-Failed-To-Disclose-Known-Headwinds-Levi-Korsinsky-LLP.html,https://ml.globenewswire.com/Resource/Download/d91bd4e6-7d18-43f7-a479-4f992242a82a,,"NEW YORK, April 13, 2026 (GLOBE NEWSWIRE) -- Levi &amp; Korsinsky, LLP examines the adequacy of Snowflake Inc.'s (NYSE: SNOW) risk disclosures during the period June 27, 2023 through February 28, 202… [+3725 chars]",,"Die allgemeinen Risikowarnungen von SNOW enthielten angeblich keine Angaben zu bekannten Gegenwinden – Levi & Korsinsky, LLP. Offenlegung auf dem Prüfstand: Waren die Risikowarnungen von Snowflake angemessen? Offenlegung auf dem Prüfstand: Waren die Risikowarnungen von Snowflake angemessen?","SNOW's Generic Risk Warnings Allegedly Failed To Disclose Known Headwinds — Levi & Korsinsky, LLP. Disclosure Under Scrutiny: Were Snowflake's Risk Warnings Adequate? Disclosure Under Scrutiny: Were Snowflake's Risk Warnings Adequate?","NIVEUS's Generic Risk Admonitiones Allegedly Deficio ad detegere Notum Headwinds — Levi & Korsinsky, LLP. Aperire sub Scrutinio: erant Snowflake Risk Admonitiones Adaequatum? Aperire sub Scrutinio: erant Snowflake Risk Admonitiones Adaequatum?",2026-04-14 19:51:21+00:00
b697adba2ff9e8ac83c92c460368a73e,2026-04-13T18:05:12Z,'snow',www.yahoo.com,en,0.9,California ski resort extends its season after a major spring snowstorm,"A spring storm dumped more than than 3.5 feet (1 meter) of snow in California's eastern Sierra Nevada, briefly closing a key interstate and extending the ski...",https://www.yahoo.com/news/articles/california-ski-resort-extends-season-180512408.html,https://s.yimg.com/ny/api/res/1.2/70lZPgjJJBNG4Y.rT7wRCQ--/YXBwaWQ9aGlnaGxhbmRlcjt3PTEyMDA7aD04OTk7Y2Y9d2VicA--/https://media.zenfs.com/en/ap.org/e04f682f783a9de32e7869378b8af8dc,,"MAMMOTH LAKES, Calif. (AP) A spring storm dumped more than than 3.5 feet (1 meter) of snow in California's eastern Sierra Nevada, briefly closing a key interstate and extending the ski season at Mamm… [+1966 chars]",,"Das kalifornische Skigebiet verlängert seine Saison nach einem heftigen Schneesturm im Frühjahr. Ein Frühlingssturm ließ mehr als 1 Meter Schnee in der östlichen Sierra Nevada in Kalifornien fallen, wodurch eine wichtige Autobahn kurzzeitig gesperrt und die Skigebiete verlängert wurden.","California ski resort extends its season after a major spring snowstorm. A spring storm dumped more than than 3.5 feet (1 meter) of snow in California's eastern Sierra Nevada, briefly closing a key interstate and extending the ski...","California ski extenditur suum tempus post maiorem ver nivis. Tempestas verna plus quam 3.5 pedes nixus (I metri) nivis in California Orientali Sierra Nevada, clavis interstatem claudens et nartam extensam breviter claudit...",2026-04-14 19:51:21+00:00
c767e04072af3ae8f8a2dde4282d2fd0,2026-04-13T19:00:15Z,'snow',kevinmd.com,en,0.9,Surviving a hospital blizzard as a physician on call,"The recent record snowstorm in New England got me all in a deep wintery nostalgia. I contacted my friends back in Boston who have been living there for well over 40 years to get their perspectives, and it brought back memories of living on the East Coast and …",https://kevinmd.com/2026/04/surviving-a-hospital-blizzard-as-a-physician-on-call.html,https://kevinmd.com/wp-content/uploads/fd6c95cc-82f6-433e-8511-3b4c3daaa5b6.jpeg,,"The recent record snowstorm in New England got me all in a deep wintery nostalgia. I contacted my friends back in Boston who have been living there for well over 40 years to get their perspectives, a… [+4752 chars]",,"Als Bereitschaftsarzt einen Krankenhaussturm überlebt. Der jüngste Rekordschneesturm in Neuengland versetzte mich in tiefe winterliche Nostalgie. Ich kontaktierte meine Freunde in Boston, die seit weit über 40 Jahren dort leben, um ihre Ansichten zu erfahren, und es weckte Erinnerungen an das Leben an der Ostküste und …","Surviving a hospital blizzard as a physician on call. The recent record snowstorm in New England got me all in a deep wintery nostalgia. I contacted my friends back in Boston who have been living there for well over 40 years to get their perspectives, and it brought back memories of living on the East Coast and …","Valetudinarium blizzard superstes quam medicum vocant. Recens recordum nivis in Nova Anglia me omnes in profunda desiderio hiemali obtinuit. Amicos meos rettuli in Boston, qui ibi bene per quadraginta annos degentes ut prospectus caperet, rettulit memoriam vivendi in Oriente oram ac …",2026-04-14 19:51:21+00:00
92b9d3d0b4c0f74de305d6801d0334a2,2026-04-13T19:35:37Z,'snow',nypost.com,en,0.9,Urgent warning issued for those visiting Yosemite after tragedy struck,"As the Sierra Nevada snowpack melts, it sends a torrent of icy runoff screaming down thousands of feet into the Merced River and surrounding creeks.",https://nypost.com/2026/04/13/us-news/urgent-warning-issued-for-those-visiting-yosemite-after-tragedy-struck/,https://nypost.com/wp-content/uploads/sites/2/2026/04/Yosemitesnowmelt.jpg?quality=75&strip=all&w=1200,,"Yosemite National Park officials are issuing a chilling warning to spring travelers: The park’s breathtaking waterfalls and scenic rivers are currently death traps.
The alert follows a heartbreaking… [+2430 chars]",,"Nach der Tragödie wurde eine dringende Warnung für Besucher von Yosemite herausgegeben. Wenn die Schneedecke der Sierra Nevada schmilzt, schickt sie einen Sturzbach aus eisigem Abfluss, der Tausende von Metern in den Merced River und die umliegenden Bäche stürzt.","Urgent warning issued for those visiting Yosemite after tragedy struck. As the Sierra Nevada snowpack melts, it sends a torrent of icy runoff screaming down thousands of feet into the Merced River and surrounding creeks.","Monitum urgente denuntiatum Yosemite visitans, postquam tragoedia percussit. Sicut Sierra Nevada snowpack liquescit, torrens emittit runoff glacialem quiritationem mille pedum in Merced flumen et circa aestuaria.",2026-04-14 19:51:21+00:00
76a547bc335cd13343c9b28774136ddf,2026-04-01T21:17:49Z,'snow climate change',www.cosmopolitan.com,en,0.3,10 Chic April Outfits Worth Screenshotting Immediately,"These April outfit ideas have me so excited for warmer weather. Perfect for rain or shine, every look is worth recreating.",https://www.cosmopolitan.com/style-beauty/fashion/a70885569/april-outfits-2026/,"https://hips.hearstapps.com/hmg-prod/images/0fda9136-0abd-4249-b146-a7ab8114826d.jpeg?crop=1xw:0.749xh;0xw,0.251xh&resize=1200:*",,"The moment April rolls around, I feel like a free woman. Weve finally broken free from the bitter cold, snow, and that soul-crushing moment when youre getting ready and you check the Weather app to s… [+4436 chars]",,"10 schicke April-Outfits, die es wert sind, sofort fotografiert zu werden. Diese Outfit-Ideen für April machen mich so gespannt auf wärmeres Wetter. Perfekt für Regen oder Sonnenschein, jeder Look ist es wert, neu kreiert zu werden.","10 Chic April Outfits Worth Screenshotting Immediately. These April outfit ideas have me so excited for warmer weather. Perfect for rain or shine, every look is worth recreating.","X pullus Aprilis Outfits Worth screenshotting Confestim. Hae notiones Apriles vestis in calidioribus tempestatibus ita me excitarunt. Perfecta pluvia vel luceat, omni vultu recreare valet.",2026-04-15 04:33:35+00:00
18995f266f8f2741f5c27547053cd402,2026-04-02T11:00:00Z,'snow climate change',wellnessmama.com,en,0.3,Spring Garden Checklist For An Easier Garden Season,"Every spring one of the things I look forward to most is getting back in the garden and yard. Living in a warmer climate I’m able to do a lot outside, but there are certain tasks that need done in the spring. Here’s what’s on my garden to-do list this spring …",https://wellnessmama.com/natural-home/spring-garden-checklist/,https://wellnessmama.com/wp-content/uploads/spring-garden.png,,"Every spring one of the things I look forward to most is getting back in the garden and yard. Living in a warmer climate Im able to do a lot outside, but there are certain tasks that need done in the… [+9055 chars]",,"Checkliste für den Frühlingsgarten für eine einfachere Gartensaison. Jeden Frühling freue ich mich am meisten darauf, wieder in den Garten und auf den Hof zu kommen. Da ich in einem wärmeren Klima lebe, kann ich viel draußen erledigen, aber es gibt bestimmte Aufgaben, die im Frühling erledigt werden müssen. Hier ist, was diesen Frühling auf meiner Garten-To-Do-Liste steht …","Spring Garden Checklist For An Easier Garden Season. Every spring one of the things I look forward to most is getting back in the garden and yard. Living in a warmer climate I’m able to do a lot outside, but there are certain tasks that need done in the spring. Here’s what’s on my garden to-do list this spring …","Spring Garden Checklist For An Facilius Garden Season. Omnis fons rerum maxime exspecto regredi in horto et vase. Multam foris agere in calidiore climate possum, sed sunt quaedam officia quae verno tempore fieri possunt. Hic est quod in horto meo est-facito hunc fontem...",2026-04-15 04:33:35+00:00
102dda5f7be2e52729a93667c6dec629,2026-04-01T10:54:57Z,'frost weather',www.themarthablog.com,en,0.8,Planting Peas in My Garden,"All of us here at my farm are thinking about the spring gardens. In fact, the season’s first peas are already in the ground. Peas thrive in cool weather, and young plants can even tolerate light frosts. It’s important to plant peas as soon as possible in spri…",https://www.themarthablog.com/2026/04/planting-peas-in-my-garden.html,,,"All of us here at my farm are thinking about the spring gardens. In fact, the seasons first peas are already in the ground.
Peas thrive in cool weather, and young plants can even tolerate light fros… [+3301 chars]",,"Erbsen in meinem Garten pflanzen. Wir alle hier auf meiner Farm denken an die Frühlingsgärten. Tatsächlich sind die ersten Erbsen der Saison bereits in der Erde. Erbsen gedeihen bei kühlem Wetter und junge Pflanzen vertragen sogar leichten Frost. Es ist wichtig, im Frühling so bald wie möglich Erbsen zu pflanzen …","Planting Peas in My Garden. All of us here at my farm are thinking about the spring gardens. In fact, the season’s first peas are already in the ground. Peas thrive in cool weather, and young plants can even tolerate light frosts. It’s important to plant peas as soon as possible in spri…","Pisorum in horto meo serito. Omnes hic apud villam meam de hortis veris cogitant. Revera, pisa primi temporis in terra iam sunt. Pisa frigoribus tempestatibus viget, novellae etiam pruinas levia tolerare possunt. Gravis est pisas quam primum in spri serere…",2026-04-15 04:33:35+00:00
c416cdf6deb7b8ac201f149f78c6a621,2026-04-09T10:19:16Z,'frost weather',www.bbc.com,en,0.8,"Rain, wind and frost to follow UK's warmest early April day in 80 years","After a brief spell of unusually warm weather, it's now time for an April weather reset with a return to cooler temperatures, with wind, rain and even some frost in the forecast as Ben Rich explains.",https://www.bbc.com/weather/articles/cr51z6418z0o,https://ichef.bbci.co.uk/ace/branded_weather/1200/cpsprodpb/7029/live/7eb02a70-33ce-11f1-a3d7-89d96357257d.jpg,,"There is nothing strange or unusual about the weather that is heading towards the UK over the next few days - it just marks a return to normal spring conditions.
It is the temperatures we have had o… [+711 chars]",,"Regen, Wind und Frost folgen auf den wärmsten frühen Apriltag in Großbritannien seit 80 Jahren. Nach einer kurzen Phase ungewöhnlich warmen Wetters ist es nun Zeit für einen Wetter-Reset im April mit einer Rückkehr zu kühleren Temperaturen, mit Wind, Regen und sogar etwas Frost, wie Ben Rich erklärt.","Rain, wind and frost to follow UK's warmest early April day in 80 years. After a brief spell of unusually warm weather, it's now time for an April weather reset with a return to cooler temperatures, with wind, rain and even some frost in the forecast as Ben Rich explains.","Imbres, venti et pruinae sequi calidissimum UK primo die Aprilis in LXXX annis. Post brevem incantationem tempestatis soliti tepidi, iam tempus est ut tempestatis Aprili reset cum reditibus ad temperaturas frigidiores, cum vento, pluvia et etiam aliquo gelu in praesagio, ut Ben Rich exponit.",2026-04-15 04:33:35+00:00
e455d1cfa2cd483d214e65b15867a976,2026-04-06T14:46:47Z,'snow',www.foxweather.com,en,0.7,"Snow, cold front headed for Northeast, including New York, putting spring on hold","Just when it seemed like spring was settling in, winter has made a comeback.",https://www.foxweather.com/weather-news/cold-front-winters-return-snow-northeast-days-record-warmth,https://nypost.com/wp-content/uploads/sites/2/2026/04/125106650.jpg?quality=75&strip=all&w=1200,,"Just when it seemed like spring was settling in, winter has made a comeback.
A fast-moving clipper system is sweeping through the Northeast, bringing light snow to major cities as parts of upstate N… [+2664 chars]",,"Schneefall, Kaltfront zieht in Richtung Nordosten, einschließlich New York, und legt den Frühling auf Eis. Gerade als es so aussah, als würde der Frühling Einzug halten, feierte der Winter sein Comeback.","Snow, cold front headed for Northeast, including New York, putting spring on hold. Just when it seemed like spring was settling in, winter has made a comeback.","Nives, frigida frons petita ad Orientem, etiam Novi Eboraci, ver in custodia ponendo. Cum instar ver consedit, hiems regressum fecit.",2026-04-15 08:16:29+00:00
db16d3f3580afc5b86e7d0c965f8ec0d,2026-04-04T00:45:45Z,'snowfall',english.khabarhub.com,en,0.9,Windstorms likely in five provinces; rain and snowfall forecast,"KATHMANDU: Changing weather patterns triggered by a westerly disturbance and local wind systems are set to affect much of the country today, with forecasts indicating windstorms across several Terai districts and rain and snowfall in hilly and mountainous reg…",https://english.khabarhub.com/2026/04/542519/,https://english.khabarhub.com/wp-content/uploads/2021/10/Weather-1-e1750897810127.jpg,,"KATHMANDU: Changing weather patterns triggered by a westerly disturbance and local wind systems are set to affect much of the country today, with forecasts indicating windstorms across several Terai … [+1303 chars]",,"Stürme wahrscheinlich in fünf Provinzen; Regen- und Schneefallvorhersage. KATHMANDU: Veränderte Wettermuster, ausgelöst durch eine westliche Störung und lokale Windsysteme, werden sich heute auf weite Teile des Landes auswirken. Prognosen deuten auf Stürme in mehreren Terai-Bezirken sowie Regen und Schneefall in hügeligen und gebirgigen Regionen hin …","Windstorms likely in five provinces; rain and snowfall forecast. KATHMANDU: Changing weather patterns triggered by a westerly disturbance and local wind systems are set to affect much of the country today, with forecasts indicating windstorms across several Terai districts and rain and snowfall in hilly and mountainous reg…","Procellae ventorum in quinque provincias sunt; pluviam et nix prospicere. KATHMANDU: Variae tempestatum exemplaria per tumultum occidentalem et systemata ventorum localium quae hodie multum afficiunt, cum praenotionibus significans procellas per varias regiones Terai et pluvias et nives in montuosa et montuosa reg…",2026-04-15 08:16:29+00:00
8bdc09bb7028df5bb6b51c6530b16330,2026-04-04T06:58:15Z,'snowfall',economictimes.indiatimes.com,en,0.9,"J&K weather alert: IMD warns 'travel only if necessary' as heavy rain & snow loom. Check forecast, dates, and affected areas","Jammu and Kashmir weather update: Jammu and Kashmir is facing severe weather conditions, with heavy rain and snowfall impacting the region. Authorities have issued a travel advisory, urging residents and tourists to avoid non-essential travel. Roads have beco…",https://economictimes.indiatimes.com/news/new-updates/jammu-kashmir-weather-alert-imd-warns-travel-only-if-necessary-as-heavy-rain-snow-loom-check-forecast-dates-and-affected-areas/articleshow/130014635.cms,"https://img.etimg.com/thumb/msid-130014799,width-1200,height-630,imgsize-1213891,overlay-economictimes/articleshow.jpg",,"Adverse weather conditions across Jammu and Kashmir have prompted authorities to issue a travel advisory, urging both residents and tourists to avoid non-essential movement as heavy rain, snowfall an… [+3133 chars]",,"J&K-Wetterwarnung: IMD warnt: „Reisen nur, wenn nötig“, da starker Regen und Schnee droht. Überprüfen Sie Prognosen, Daten und betroffene Gebiete. Wetter-Update für Jammu und Kashmir: Jammu und Kashmir sind mit schweren Wetterbedingungen konfrontiert, mit starkem Regen und Schneefall, die sich auf die Region auswirken. Die Behörden haben eine Reisewarnung herausgegeben, in der sie Einwohner und Touristen auffordern, nicht unbedingt notwendige Reisen zu vermeiden. Straßen sind …","J&K weather alert: IMD warns 'travel only if necessary' as heavy rain & snow loom. Check forecast, dates, and affected areas. Jammu and Kashmir weather update: Jammu and Kashmir is facing severe weather conditions, with heavy rain and snowfall impacting the region. Authorities have issued a travel advisory, urging residents and tourists to avoid non-essential travel. Roads have beco…","J&K tempestas vigilat: IMD monet 'iter tantum si opus est' sicut pluviae & nix gravis. Praesagire, tempora, et loca affectata sisto. Jammu et Kashmir tempestas renovatio: Jammu et Kashmir adversae tempestatum graves sunt, cum pluviae et nix impacto regionem. Auctoritates iter advisorium emiserunt, incolas et peregrinatores ad vitandum peregrinationes non essentiales impellentes. Viae habent beco ...",2026-04-15 08:16:29+00:00
b4cc6c5b008658c7bce6a9731eadd27b,2026-04-04T10:25:28Z,'snow ice',economictimes.indiatimes.com,en,0.9,"Polar vortex collapse forecast for U.S., Canada: Heavy snowfall, severe tornado alert, thunderstorm warning issued for Easter Saturday","U.S. Weather Forecast: Freezing rain will pound areas across eastern Minnesota, Northern Wisconsin, and Northern Michigan. The ice storm may lead to tree damages and power outages in those areas.",https://economictimes.indiatimes.com/news/international/us/polar-vortex-collapse-forecast-for-u-s-canada-heavy-snowfall-severe-tornado-alert-thunderstorm-warning-issued-for-easter-saturday/articleshow/130017278.cms,"https://img.etimg.com/thumb/msid-130017278,width-1200,height-630,imgsize-24450,overlay-economictimes/articleshow.jpg",,"(Catch all the US News, UK News, Canada News, International Breaking News Events, and Latest News Updates on The Economic Times.)
Download The Economic Times News App to get Daily International News… [+8 chars]",,"Vorhersage eines Zusammenbruchs des Polarwirbels für die USA und Kanada: Starker Schneefall, schwere Tornado-Warnung, Gewitterwarnung für Ostersamstag. Wettervorhersage für die USA: Eisiger Regen wird Gebiete in Ost-Minnesota, Nord-Wisconsin und Nord-Michigan treffen. Der Eissturm kann in diesen Gebieten zu Baumschäden und Stromausfällen führen.","Polar vortex collapse forecast for U.S., Canada: Heavy snowfall, severe tornado alert, thunderstorm warning issued for Easter Saturday. U.S. Weather Forecast: Freezing rain will pound areas across eastern Minnesota, Northern Wisconsin, and Northern Michigan. The ice storm may lead to tree damages and power outages in those areas.","Praecognoscere ruinam polaris vortice Americae, Canada: Gravis nix, gravis turbo vigilans, tonitruum monitum Saturni Paschatis edita. U.S. Tempestas Weather: glauca pluvia areas per Minnesotam orientalem, Wisconsin septentrionalem, et Michigan Septentrionalem. Tempestas glaciei potest ducere ad damna lignorum et vim outages in locis illis.",2026-04-15 08:16:29+00:00
