index,published,keyword,domain,language,valid,title,description,url,image,archive,content,quote
e574c099090d28c41209019449c8b0cb,2025-10-07T11:50:17Z,'frost weather',biztoc.com,en,1.0,Winter Weather Warning as 10 Inches of Snow To Hit,"Americans in multiple states have been issued winter weather-related alerts from the National Weather Service (NWS) as of early Tuesday, with up to 10 inches of snow expected in some parts of the country and other areas facing frost and freeze conditions.
Why…",https://biztoc.com/x/12cd78ac2014c392,https://biztoc.com/cdn/12cd78ac2014c392_s.webp,http://web.archive.org/web/20251007135439/https://biztoc.com/x/12cd78ac2014c392,"Americans in multiple states have been issued winter weather-related alerts from the National Weather Service (NWS) as of early Tuesday, with up to 10 inches of snow expected in some parts of the cou… [+146 chars]",
c21a6d5e7feb7d0b21280d9e3637a635,2025-10-07T18:28:24Z,'snow',www.bbc.com,en,1.0,Everest hikers guided to safety after being stranded by blizzard,Hundreds of hikers have been guided to safety in Tibet after becoming trapped over the weekend by heavy snowfall.,https://www.bbc.com/news/articles/cd079zn2m5vo,https://ichef.bbci.co.uk/news/1024/branded_news/6460/live/088f0f50-a3a5-11f0-928c-71dbb8619e94.jpg,http://web.archive.org/web/20251007235205/https://www.bbc.com/news/articles/cd079zn2m5vo,"Stephen McDonellChina correspondent
A total of 580 hikers who were trapped by severe weather near Mount Everest have been guided to safety in Tibet, according to Chinese state media.
The trekkers a… [+2479 chars]",
331d31fa625f84ebc271e465ea24a2e2,2025-10-08T13:38:36Z,'frost weather',www.cbc.ca,en,1.0,Fall weather on the way as Environment Canada forecasts risk of frost in Toronto overnight,Environment Canada says temperatures could drop to 3 C Wednesday night with a chance of frost in the forecast.,https://www.cbc.ca/news/canada/toronto/frost-risk-toronto-9.6931318,"https://i.cbc.ca/ais/e4967813-5971-48d7-97d1-94bc93214de0,1759925371433/full/max/0/default.jpg?im=Crop%2Crect%3D%280%2C522%2C5568%2C3132%29%3BResize%3D620",,"October might start to actually feel like October on Wednesday, with Environment Canada warning of a risk of frost in Toronto overnight.
While this past weekend saw temperatures above 20 C in the ci… [+367 chars]",
c03b751e4e75c7102487d898ab6f900e,2025-10-09T16:40:00Z,'frost weather',www.orlandosentinel.com,en,0.0,"Game time: Fast facts, odds, keys to UCF Knights vs. Cincinnati","UCF at Cincinnati Where: Nippert Stadium When: Saturday, Noon TV: FS1 Weather: 63 degrees with 0% chance of precipitation Latest line: Cincinnati by 11.5 points Coaches: Scott Frost, 3rd season at UCF, 22-9 (38-40 overall); Scott Satterfield, 3rd season at Ci…",https://www.orlandosentinel.com/2025/10/09/ucf-knights-vs-cincinnati-bearcats-tv-info-betting-odds-keys/,https://www.orlandosentinel.com/wp-content/uploads/2025/10/TOS-L-UCFKansasFootball20920_99684d.jpg?w=1024&h=688,http://web.archive.org/web/20251009171951/https://www.orlandosentinel.com/2025/10/09/ucf-knights-vs-cincinnati-bearcats-tv-info-betting-odds-keys/,"UCF at Cincinnati
Where: Nippert Stadium
When: Saturday, Noon
TV: FS1
Weather: 63 degrees with 0% chance of precipitation
Latest line: Cincinnati by 11.5 points
Coaches:Scott Frost, 3rd season … [+2570 chars]",
73a800ed8111d81f595d0beeca6f4eed,2025-10-09T22:29:13Z,'snow',www.q13fox.com,en,0.0,First WA snow of the season to hit this week. Here's where,"Washington's mountains may see their first round of snow this weekend, with elevations above 4,000 feet affected.",https://www.q13fox.com/news/first-wa-snow-season,https://s.yimg.com/ny/api/res/1.2/92F8f1utEcgyP8pGqtcNBw--/YXBwaWQ9aGlnaGxhbmRlcjt3PTEyMDA7aD02NzU7Y2Y9d2VicA--/https://media.zenfs.com/en/kcpq_fox_local_articles_135/a5f6959ae02fcc8799cf307182ebf641,,"The Brief
<ul><li>Washington's mountains may see snow this weekend, with elevations above 4,000 feet affected.
</li><li>Areas like Stevens Pass could receive a dusting of snow, while lower elevatio… [+1869 chars]",
482ab4d008fe3883aa982653c68e6c64,2025-10-10T12:32:27Z,'frost weather',biztoc.com,en,0.0,Millions Face Plummeting Sub-Freezing Temperatures in 13 States,"Millions of Americans face sub-freezing conditions on Friday as temperatures plummet and wintery conditions hit.
The National Weather Service (NWS) has issued freeze warnings and frost advisories for large swathes of Maine, New Hampshire, Vermont, New York, P…",https://biztoc.com/x/e5db7e0af1b189d1,https://biztoc.com/cdn/e5db7e0af1b189d1_s.webp,http://web.archive.org/web/20251010135440/https://biztoc.com/x/e5db7e0af1b189d1,Millions of Americans face sub-freezing conditions on Friday as temperatures plummet and wintery conditions hit.The National Weather Service (NWS) has issued freeze warnings and frost advisories for … [+144 chars],
5dd04a7d07d55c7f8a6ece3758ddf779,2025-10-11T13:00:00Z,'snow',cheezburger.com,en,0.0,"‘I can't lift heavy snow. But you don't care about me’: Neighborhood resident demands man use his snow blower to clean his area of the sidewalk, then berates him for a few minutes in front of his toddler-aged son before finally offering to pay him","Winter weather incites and invites winter madness. We're all cooped up inside, with nothing to do, but would rather be six feet under than go outside in sub-10-degree weather with a shovel and gloves that don't actually keep our hands warm. Even still, our fe…",https://cheezburger.com/42725637/i-cant-lift-heavy-snow-but-you-dont-care-about-me-neighborhood-resident-demands-man-use-his-snow,https://i.chzbgr.com/thumb1200/42725637/h7B630EE2/shoveling-winter-weather-snow-toddler-son-father-resident-homeowner-neighborhood-reddit-story,http://web.archive.org/web/20251012090517/https://cheezburger.com/42725637/i-cant-lift-heavy-snow-but-you-dont-care-about-me-neighborhood-resident-demands-man-use-his-snow,"Winter weather incites and invites winter madness. We're all cooped up inside, with nothing to do, but would rather be six feet under than go outside in sub-10-degree weather with a shovel and gloves… [+952 chars]",
26291d65629860f789e7ea3a3118db8a,2025-10-12T17:28:32Z,'winter service',ktla.com,en,0.0,NWS says ‘winter-like storm’ coming to Southern California; flood watch issued,The National Weather Service is advising SoCal residents that a “winter-like storm system” will make its way to the region this week. The storm system is set...,https://ktla.com/weather/winter-like-storm-coming-to-southern-california-this-week-nws-says/,https://media.zenfs.com/en/ktla_articles_362/251f69bcef13a7a734f6a6ab5165495a,,"The National Weather Service is advising SoCal residents that a winter-like storm system will make its way to the region this week.
The storm system is set to arrive late Monday and hover over the a… [+2710 chars]",
29afea475c60cff392f455561f014b0a,2025-10-13T10:00:00Z,'snow',www.newyorker.com,en,0.0,"Peter Matthiessen Travelled the World, Trying to Escape Himself","Maggie Doherty reviews “True Nature,” Lance Richardson’s biography of the nature writer, novelist, and New Yorker journalist who published “The Snow Leopard” and “At Play in the Fields of the Lord.”",https://www.newyorker.com/magazine/2025/10/20/true-nature-the-pilgrimage-of-peter-matthiessen-lance-richardson-book-review,"https://media.newyorker.com/photos/68e526bcb2488bc78f4bfbcf/16:9/w_1280,c_limit/r47626.jpg",http://web.archive.org/web/20251109085652/https://www.newyorker.com/magazine/2025/10/20/true-nature-the-pilgrimage-of-peter-matthiessen-lance-richardson-book-review,"But it wasnt until he arrived in Paris, during his junior year abroad, that he could truly nurture his bohemian streak. The city was still reeling from the Second World War. The power went out interm… [+6162 chars]",
3f25cc29ec04532e245809b60c6754c2,2025-10-13T15:35:59Z,'snow',www.yahoo.com,en,0.0,"Biggest Pacific storm in months to soak California, bring mountain snow","The first snow since spring is forecast for some across the western U.S., while others can expect a dose of heavy rain and flooding.",https://www.yahoo.com/news/articles/biggest-pacific-storm-months-soak-153559954.html,https://media.zenfs.com/en/accuweather_articles_339/90b62d9a7f9e92156fac72997b36b42b,,"A storm will barrel across the West Coast this week, bringing much-needed rain and some mountain snow for the first time since early spring.
Showers began breaking out across Oregon and Northern Cal… [+3182 chars]",
ca6b5065c17b3bfb3442a704f5db303d,2025-10-13T17:00:00Z,'snowfall',helenair.com,en,0.9,Helena area hammered by early-season snow; some power outages reported,"Some preliminary snowfall reports show 10 inches near central Helena, 8 inches on Helena’s west side, 7 inches near Montana City and 6 inches in East Helena.",https://helenair.com/news/local/weather/article_09390f45-c357-4b15-99bd-316d8b08bed3.html,https://bloximages.chicago2.vip.townnews.com/billingsgazette.com/content/tncms/assets/v3/editorial/7/e9/7e970c01-438d-5ace-9b8d-50c45315bdfd/68ed31200d2d6.preview.jpg?crop=1763%2C926%2C0%2C124&resize=1200%2C630&order=crop%2Cresize,,"The Helena Regional Airport set a 24-hour snowfall record for Oct. 12 on Sunday, and residents woke up Monday to another several inches, dropping leaf-laden trees and causing some power outages.
The… [+6328 chars]",
907f4c1cc666492174e5f3fe43028e27,2025-10-14T14:58:44Z,'snowfall',biztoc.com,en,0.0,Winter Weather Alerts Issued for 5 States With 16 Inches of Snow to Hit,"Several parts of the U.S. had been issued winter weather-related alerts as of early Tuesday, with up to 16 inches of snow expected for some parts of the country.
Why It Matters
In California, the NWS said snowfall could lead to dangerous driving conditions, w…",https://biztoc.com/x/d9b82c0988b2c8e9,https://biztoc.com/cdn/d9b82c0988b2c8e9_s.webp,,"Several parts of the U.S. had been issued winter weather-related alerts as of early Tuesday, with up to 16 inches of snow expected for some parts of the country.Why It MattersIn California, the NWS s… [+143 chars]",
b24aa041325fec262ceac95d802b8f14,2025-10-14T15:36:18Z,'slippery roads',freerepublic.com,en,0.1,Newsmax Obtains Dashcam Video Contradicting Alec Baldwin's Car Crash,"Newsmax has obtained exclusive dashcam footage that appears to contradict Alec Baldwin's account of how he and his brother Stephen Baldwin were involved in a car crash Monday afternoon. The 1-minute, 29-second front-facing video, taken from the commercial tru…",https://freerepublic.com/focus/f-chat/4346295/posts,,,"Skip to comments.
Newsmax Obtains Dashcam Video Contradicting Alec Baldwin's Car Crash Newsmax ^
 | October 14, 2025
 | Newsmax Wires
Posted on 10/14/2025 8:36:18 AM PDT by Navy Patriot
Newsmax … [+6059 chars]",
85dcb636c9ab1d7d72149a5951398a40,2025-10-14T16:32:58Z,'snow',www.insurancejournal.com,en,0.0,South Dakota Farmers Use Farm Tunnels for Longer Growing Season,"When snow covers the frozen ground, and most South Dakota farmers have sold or stored their products for the season, the operators of Cedar Creek Gardens are still able to grow vegetables and harvest a lucrative crop. Located in a …",https://www.insurancejournal.com/news/midwest/2025/10/14/843655.htm,https://www.insurancejournal.com/app/uploads/2025/10/South-Dakota-Tunnel-Farming-scaled.jpg,,"When snow covers the frozen ground, and most South Dakota farmers have sold or stored their products for the season, the operators of Cedar Creek Gardens are still able to grow vegetables and harvest… [+7363 chars]",
fd64d7533feb3ff6027a7d1adb3ebed1,2025-10-15T02:45:00Z,'road salt',www.yahoo.com,en,0.0,Drivers face steep penalties after harmful off-road incident: 'It's never-ending',"""This should get treated no differently.""",https://www.yahoo.com/news/articles/drivers-face-steep-penalties-harmful-024500589.html,https://s.yimg.com/ny/api/res/1.2/iRG7.yoVmnuYHo0rZIECSw--/YXBwaWQ9aGlnaGxhbmRlcjt3PTEyMDA7aD02NzU7Y2Y9d2VicA--/https://media.zenfs.com/en/the_cool_down_737/1099d75ad90c8a81cde5fec1fc3bca9c,,"Two 4x4 vehicles were found stuck and abandoned in a protected salt pan in North Queensland, the Australian Broadcasting Corporation reported. These stuck vehicles not only cost thousands of dollars … [+3388 chars]",
f402d1d21dd3a8ec05c7ed0fe407f777,2025-10-15T15:46:33Z,'snow',www.yahoo.com,en,0.0,Powerful storm delivers wettest October day in years to California cities,"The biggest storm in months unloaded heavy rain and mountain snow across California to start the week, forcing evacuations near areas devastates by historic ...",https://www.yahoo.com/news/articles/powerful-storm-delivers-wettest-october-154633644.html,https://media.zenfs.com/en/accuweather_articles_339/c26e59e70fad9c816cad9e92a82d1bea,,"The first major storm in months barreled into California earlier this week, delivering the wettest October day in years and prompting evacuations near areas scarred by the historic wildfires from Jan… [+2711 chars]",
eb7f90cf69bc05ee8b56ca9739be26ab,2025-10-15T16:56:49Z,'snow',www.forbes.com,en,0.0,Genomics Reveals Snow Leopards Have Always Been Rare,"Whole genome sequencing has revealed that snow leopards have low genetic diversity because they are rare, and probably always have been.",https://www.forbes.com/sites/grrlscientist/2025/10/15/genomics-reveals-snow-leopards-have-always-been-rare/,https://imageio.forbes.com/specials-images/imageserve/68ea36bc8350329900f0dbfb/0x0.jpg?format=jpg&height=900&width=1600&fit=bounds,,"Whole genome sequencing has revealed that snow leopards have low genetic diversity because they are rare, and probably always have been.
Snow Leopard (Panthera uncia). (Credit: Paul Groom Photograph… [+9846 chars]",
095c831a1f83d26cb4481d4273972968,2025-10-16T14:51:11Z,'snow',www.usatoday.com,en,0.0,"How cold, snowy will winter be? New NOAA forecast holds clues.",The forecast released Oct. 16 predicts where above- or below-normal temperatures and above- or below-normal precipitation are most likely.,https://www.usatoday.com/story/news/weather/2025/10/16/winter-2025-2026-forecast-noaa-maps-snow-outlook/86694244007/,https://s.yimg.com/ny/api/res/1.2/rvoQ4hqtfziaE5mrfk1SWw--/YXBwaWQ9aGlnaGxhbmRlcjt3PTEyMDA7aD05Mjc7Y2Y9d2VicA--/https://media.zenfs.com/en/usa_today_news_641/3d068e98674aa34f38d087e3ff0bef3c,,"Winter is coming but how cold is it going to be? Federal forecasters from NOAA's Climate Prediction Center gave us their answer Oct. 16 in their annual winter outlook.
According to the forecast, a w… [+6430 chars]",
0ffb0642789bbda7536897e533d5b0d6,2025-10-16T18:11:03Z,'snow',phys.org,en,0.0,Snow dump and inactive landfills flagged as major methane polluters,"Montreal's methane (CH4) emissions are unevenly distributed across the island, with the highest concentrations in the city's east end, McGill researchers have found. The worst polluters include the city's largest snow dump, which emits methane at levels compa…",https://phys.org/news/2025-10-dump-inactive-landfills-flagged-major.html,https://scx2.b-cdn.net/gfx/news/2025/research-flags-montrea.jpg,,"Montreal's methane (CH4) emissions are unevenly distributed across the island, with the highest concentrations in the city's east end, McGill researchers have found. The worst polluters include the c… [+3764 chars]",
384179fec6edb103d97d5ab3d06f97d2,2025-10-16T19:06:02Z,'snow',www.foxweather.com,en,0.0,Hypothermic hiker rescued off Utah cliff after wandering off-trail in snowstorm,A hiker was rescued on Saturday night after being stranded for hours on Utah's Mount Superior in Little Cottonwood Canyon.,https://www.foxweather.com/weather-news/hiker-rescued-after-being-stranded-hours-utah-cliff-during-snowstorm,https://nypost.com/wp-content/uploads/sites/2/2025/10/04-pm-salt-lake-county-113583682.jpg?quality=75&strip=all&w=1024,,"A hiker was rescued on Saturday night after being stranded for hours on Utah’s Mount Superior in Little Cottonwood Canyon.  
Around 7 p.m., Salt Lake County Sheriffs Search and Rescue was called to … [+2985 chars]",
e0a2d5c35865bec421211e6a2077f6f5,2025-10-16T22:05:52Z,'frost weather',biztoc.com,en,1.0,Cold Weather Warnings Expand to 12 States,"Various cold weather alerts are in place for 12 states on Thursday afternoon as temperatures drop to dangerous levels for outdoor plumbing and vegetation.
Why It Matters
The National Weather Service (NWS) has issued frost advisories and freeze warnings across…",https://biztoc.com/x/9625d51897e48c05,https://biztoc.com/cdn/9625d51897e48c05_s.webp,,Various cold weather alerts are in place for 12 states on Thursday afternoon as temperatures drop to dangerous levels for outdoor plumbing and vegetation.Why It MattersThe National Weather Service (N… [+144 chars],
5e050017ef42b066cb71f89645623aa5,2025-10-17T13:00:00Z,'frost weather',www.orlandosentinel.com,en,0.0,"Game time: Fast facts, odds, keys to UCF Knights vs. West Virginia","West Virginia at UCF Where: Acrisure Bounce House Stadium When: Saturday, 1 p.m. TV: TNT/TruTV/HBO Weather: 79 degrees with 0% chance of precipitation Latest line: UCF by 7.5 points Coaches: Scott Frost, 3rd season at UCF, 22-10 (38-41 overall); Rich Rodrigue…",https://www.orlandosentinel.com/2025/10/17/ucf-knights-vs-west-virginia-tv-info-betting-odds-keys/,https://s.yimg.com/cv/apiv2/social/images/yahoo_default_logo-1200x1200.png,,"West Virginia at UCF
Where:Acrisure Bounce House Stadium
When: Saturday, 1 p.m.
TV: TNT/TruTV/HBO
Weather: 79 degrees with 0% chance of precipitation
Latest line: UCF by 7.5 points
Coaches:Scot… [+2658 chars]",
0f1000f5f6973a9010e453056c8a1f1d,2025-10-18T16:42:17Z,'frost weather',timesofindia.indiatimes.com,en,0.0,"What is fall golf? Weather, strategy, and 5 things every golfer should know","Fall golf offers a refreshing escape with cool air and vibrant scenery. However, golfers must adapt to challenging conditions like dew, frost, and wind-blown leaves. Strategic adjustments to equipment, swing, and course awareness are key to maintaining perfor…",https://timesofindia.indiatimes.com/sports/international-sports/what-is-fall-golf-weather-strategy-and-5-things-every-golfer-should-know/articleshow/124672720.cms,"https://static.toiimg.com/thumb/msid-124672701,width-1070,height-580,imgsize-821699,resizemode-75,overlay-toi_sw,pt-32,y_pad-40/photo.jpg",,"<ul><li>News</li>
<li>Sports News</li>
<li>What is fall golf? Weather, strategy, and 5 things every golfer should know</li></ul>
Fall golf offers a refreshing escape with cool air and vibrant scen… [+391 chars]",
452c411ddf83a68bfb2912b0bb7757ec,2025-10-20T04:51:50Z,'slippery roads',en.protothema.gr,en,0.1,Weather: Bad weather in two waves with heavy rain and storms – Which areas are affected,"Heavy rainfalls yesterday in the Peloponnese – EMY forecast up to Friday
The post Weather: Bad weather in two waves with heavy rain and storms – Which areas are affected appeared first on ProtoThema English.",https://en.protothema.gr/2025/10/20/weather-bad-weather-in-two-waves-with-heavy-rain-and-storms-which-areas-are-affected/,https://en.protothema.gr/wp-content/uploads/2025/10/vroxes-arthrou-1.jpg-1.jpg,,"The weather this week will follow an autumnal pattern, with two waves of bad weather affecting the country from today until Thursday. Meteorologists are warning of heavy rainfalls, local thunderstorm… [+5559 chars]",
74033f2b9a43041988692417a7720f41,2025-10-20T11:52:41Z,'frost weather',biztoc.com,en,1.0,Warning Issued For Thousands As Temperatures Plummet: 'Take Steps Now',"The National Weather Service (NWS) has issued frost advisories impacting thousands across Wisconsin, Kansas, Nebraska, and California.
Why It Matters
Residents are urged to safeguard plants, as overnight lows across multiple states create the potential for da…",https://biztoc.com/x/859d38a1975f0644,https://biztoc.com/cdn/859d38a1975f0644_s.webp,,"The National Weather Service (NWS) has issued frost advisories impacting thousands across Wisconsin, Kansas, Nebraska, and California.Why It MattersResidents are urged to safeguard plants, as overnig… [+136 chars]",
966d9f156e572766aa1bbc8cddf763a7,2025-10-20T17:00:00Z,'snow ice',www.pcworld.com,en,0.0,Yarbo robotic snow blower review: A yard crawler for all seasons,"TechHive Editors Choice

At a glance
Expert's Rating


Pros

<ul>
<li>Extremely maneuverable</li>



<li>Great features</li>



<li>Cool modular concept</li>



<li>Stable and easy to use app</li>
</ul>





Cons

<ul>
<li>The price tag</li>
</ul>




…",https://www.pcworld.com/article/2937640/yarbo-robotic-snow-blower-review.html,https://www.pcworld.com/wp-content/uploads/2025/10/2-IMG_1364.jpg?quality=50&strip=all&w=1024,,"Skip to contentWhen you purchase through links in our articles, we may earn a small commission. This doesn't affect our editorial independence
.
At a glance
<ul><li>Extremely maneuverable</li><li>… [+7090 chars]",
6b23dd59dd6ccc991763a01ef09f3a85,2025-10-20T21:30:01Z,'frost weather',biztoc.com,en,0.0,Warning Issued as Freezing Temperatures Hit Texas,"National Weather Service (NWS) meteorologists are warning thousands of people in Northern Texas that freezing temperatures are expected during the early morning hours on Tuesday.
The same forecast area also saw a risk of frost on Sunday morning, NWS meteorolo…",https://biztoc.com/x/73ba9f92974892d7,https://biztoc.com/cdn/73ba9f92974892d7_s.webp,,National Weather Service (NWS) meteorologists are warning thousands of people in Northern Texas that freezing temperatures are expected during the early morning hours on Tuesday.The same forecast are… [+139 chars],
6aa1dd8f9df4d29d03b3fc75daa7eabf,2025-10-23T04:02:56Z,'slippery roads',www.thehindubusinessline.com,en,0.0,"Tamil Nadu: IMD predicts light to moderate rain, thunderstorms in Kanyakumari, other districts","The IMD has issued a warning of potential waterlogging, slippery roads, and traffic disruptions in certain areas, as well as light rain in isolated places over the Chengalpattu, Chennai, and Thiruvallur districts of Tamil Nadu",https://www.thehindubusinessline.com/news/tamil-nadu-imd-predicts-light-to-moderate-rain-thunderstorms-in-kanyakumari-other-districts/article70192209.ece,https://bl-i.thgim.com/public/incoming/1tjrmw/article70192221.ece/alternates/LANDSCAPE_1200/23cb_Rain1.jpg,,"The India Meteorological Department (IMD) has forecast light to moderate rain accompanied by thunderstorms and lightning at isolated places over Kanyakumari, Thoothukkudi, Tenkasi, and Tirunelveli di… [+2182 chars]",
54065f165c7dfeca747781074fdfca34,2025-10-23T11:02:13Z,'snow',kottke.org,en,0.0,“I fell at the top of a mountain – and knew I...,"“I fell at the top of a mountain – and knew I had to haul my broken body down or die in the snow.” Holy moly, this is",https://kottke.org/25/10/0047756-i-fell-at-the-top,,,"×Hello! In order to comment or fave, you need to be a current kottke.org member. If you'd like to sign up for a
 membership to support the site and join the conversation, you can explore your option… [+341 chars]",
878821c5a9aba2fe6e72e09500a99a33,2025-10-24T10:07:12Z,'snow',www.yankodesign.com,en,0.0,This Japanese Data Center Uses Snow and Wind to Stay 100% Green,"This Japanese Data Center Uses Snow and Wind to Stay 100% GreenHere’s something you don’t hear every day: a data center in Ishikari, Japan that was completed in 2024 is using Hokkaido’s freezing winter air and...",https://www.yankodesign.com/2025/10/24/this-japanese-data-center-uses-snow-and-wind-to-stay-100-green/,https://www.yankodesign.com/images/design_news/2025/10/this-japanese-data-center-uses-snow-and-wind-to-stay-100-green/zed-01.jpg,,"Here’s something you don’t hear every day: a data center in Ishikari, Japan that was completed in 2024 is using Hokkaido’s freezing winter air and renewable energy to run completely emission-free. No… [+3981 chars]",
697732f7a2bcd4cee431cc13f7bec25f,2025-10-24T15:00:28Z,'snow',disneyparksblog.com,en,0.0,New LEGO Disney Frozen Special on Disney+ to Celebrate Frozen Fan Fest,"Get ready to return to the enchanting world of Disney’s Frozen as we continue the celebration of Frozen Fan Fest with even more snow-stopping news. Just in time for the celebration, Disney and LEGO are releasing a brand-new animated special, LEGO Disney Froze…",https://disneyparksblog.com/products/new-lego-disney-frozen-special-on-disney-to-celebrate-frozen-fan-fest/,https://disneyparksblog.com/app/uploads/2025/10/New-LEGO-Disney-Frozen-SpecialContent-on-Disney-to-Celebrate-Frozen-Fan-Fest-.jpg,,"Get ready to return to the enchanting world of Disney’s Frozen as we continue the celebration of Frozen Fan Fest with even more snow-stopping news. Just in time for the celebration, Disney and LEGO a… [+2405 chars]",
8580e96a6b73c659acf90c3e5de71edb,2025-10-25T11:12:09Z,'slippery roads',www.theverge.com,en,0.1,Is Waymo ready for winter?,"During a recent all-hands meeting, Waymo's chief winter weather expert laid it out for all the company's engineers and product managers: if Waymo wants to expand to new cities and new markets, it's robotaxis will need to be able to confidently and safely hand…",https://www.theverge.com/transportation/805471/waymo-robotaxi-winter-snow-weather-testing,https://platform.theverge.com/wp-content/uploads/sites/2/2025/10/258030_waymo_snow_CVirginia.jpg?quality=90&strip=all&crop=0%2C10.732984293194%2C100%2C78.534031413613&w=1200,,"<ul><li></li><li></li><li></li></ul>
Snow and ice pose unique challenges for driverless cars. And Waymos expansion depends on its ability to tackle them head on.
Snow and ice pose unique challenges… [+7303 chars]",
