index,published,keyword,domain,language,valid,title,description,url,image,archive,content,quote,de,en,la,added
9384113e5f390f357f58823fb41b9c7b,2026-04-09T14:00:00Z,'snow climate change',journals.plos.org,en,0.3,Grassland restoration in typical wind-eroded regions effectively increase soil organic carbon,"Soil organic and inorganic carbon (SOC and SIC, respectively) are the two most important carbon pools in the terrestrial carbon cycle, yet their responses to land use change in typical wind-eroded regions remain poorly understood. This study analyzed the carb…",https://journals.plos.org/plosone/article?id=10.1371/journal.pone.0346688,https://journals.plos.org/plosone/article/figure/image?id=10.1371/journal.pone.0346688.g008&size=inline,http://web.archive.org/web/20260412072243/https://journals.plos.org/plosone/article?id=10.1371%2Fjournal.pone.0346688,"Abstract
Soil organic and inorganic carbon (SOC and SIC, respectively) are the two most important carbon pools in the terrestrial carbon cycle, yet their responses to land use change in typical wind… [+42065 chars]",,"Die Wiederherstellung von Grünland in typischen, vom Wind erodierten Regionen erhöht wirksam den organischen Kohlenstoff im Boden. Organischer und anorganischer Bodenkohlenstoff (SOC bzw. SIC) sind die beiden wichtigsten Kohlenstoffspeicher im terrestrischen Kohlenstoffkreislauf, ihre Reaktionen auf Landnutzungsänderungen in typischen winderosierten Regionen sind jedoch noch wenig verstanden. Diese Studie analysierte die Kohlenhydrate…","Grassland restoration in typical wind-eroded regions effectively increase soil organic carbon. Soil organic and inorganic carbon (SOC and SIC, respectively) are the two most important carbon pools in the terrestrial carbon cycle, yet their responses to land use change in typical wind-eroded regions remain poorly understood. This study analyzed the carb…","Grassland restitutio in regionum ventorum erosis typicis efficaciter auget carbonem terrae organicum. Solum organicum et inorganicum carbonis (SOC et SIC respective) sunt duae maximae piscinae carbonis carbonis terrestris in cyclo terrestri, attamen responsa ad usum terrestrem mutationem in regiones ventorum erosas typicas male intellectas manent. Hoc studium carb resolvitur…",2026-04-16 04:39:18+00:00
484b823608a80f2f703de0a0bbedbbbe,2026-04-07T18:05:23Z,'snowfall',assetstore.unity.com,en,0.7,Procedural Snow Particles by Gece Studio,"Included:<ul><li>Resources(Script, vfx asset, texture)</li><li>1x Prefab</li><li>Demo Scene</li><li>Documentation</li></ul>Note: The character and its controller are not included.* When you open the demo scene in HDRP, it will appear pink. However, this is no…",https://assetstore.unity.com/packages/vfx/particles/procedural-snow-particles-371574,https://assetstorev1-prd-cdn.unity3d.com/key-image/6f5d2d6a-6011-41ac-a9aa-18ea85f8ea95.jpg?v=1,,"Over 11,000 five-star assets
Rated by 85,000+ customers
Supported by 100,000+ forum members
Every asset moderated by Unity",,"Prozedurale Schneepartikel von Gece Studio. Enthalten:<ul><li>Ressourcen (Skript, VFX-Asset, Textur)</li><li>1x vorgefertigte</li><li>Demoszene</li><li>Dokumentation</li></ul>Hinweis: Der Charakter und sein Controller sind nicht enthalten.* Wenn Sie die Demoszene in HDRP öffnen, erscheint sie rosa. Dies ist jedoch kein…","Procedural Snow Particles by Gece Studio. Included:<ul><li>Resources(Script, vfx asset, texture)</li><li>1x Prefab</li><li>Demo Scene</li><li>Documentation</li></ul>Note: The character and its controller are not included.* When you open the demo scene in HDRP, it will appear pink. However, this is no…","Particulae processuales nivis per Gece Studio. Includitur: <ul><li>Resources(Script, vfx dignissim, textura</li><li>1x Prefab</li><li>Demo Scene</li><li>Documenta</li></ul>Nota: Character et eius moderator non includitur.* Cum demom scaenam in HDRP aperueris, rosea apparebit. Sed id nulla…",2026-04-16 04:39:18+00:00
cd19c5b65163ff094916892e64c1ab87,2026-04-07T21:01:06Z,'snow',economictimes.indiatimes.com,en,0.9,"Heavy Snow Warning Issued: Powerful storm brings snow, ice, and freezing temperatures Across U.S","Heavy Snow Warning: A powerful winter system is moving across the United States beginning Tuesday, bringing heavy snow, strong winds, and freezing temperatures across at least 12 states. The National Weather Service warns that travel could become dangerous du…",https://economictimes.indiatimes.com/news/international/us/heavy-snow-warning-issued-powerful-storm-brings-snow-ice-and-freezing-temperatures-across-u-s/articleshow/130096797.cms,"https://img.etimg.com/thumb/msid-130096797,width-1200,height-630,imgsize-243564,overlay-economictimes/articleshow.jpg",http://web.archive.org/web/20260408055325/https://economictimes.indiatimes.com/news/international/us/heavy-snow-warning-issued-powerful-storm-brings-snow-ice-and-freezing-temperatures-across-u-s/articleshow/130096797.cms,"A powerful winter system is moving across the United States beginning Tuesday, bringing heavy snow, strong winds, and freezing temperatures across at least 12 states. The National Weather Service (NW… [+3574 chars]",,"Warnung vor starkem Schneefall: Ein heftiger Sturm bringt Schnee, Eis und Temperaturen unter dem Gefrierpunkt in den USA. Warnung vor starkem Schneefall: Ab Dienstag zieht ein starkes Wintersystem über die Vereinigten Staaten und bringt in mindestens 12 Bundesstaaten heftigen Schneefall, starke Winde und Temperaturen unter dem Gefrierpunkt. Der Nationale Wetterdienst warnt davor, dass Reisen gefährlich werden könnten, wenn …","Heavy Snow Warning Issued: Powerful storm brings snow, ice, and freezing temperatures Across U.S. Heavy Snow Warning: A powerful winter system is moving across the United States beginning Tuesday, bringing heavy snow, strong winds, and freezing temperatures across at least 12 states. The National Weather Service warns that travel could become dangerous du…","Gravis Nivis Admonitio Edita: Valida tempestas nives, glaciem, et per U.S. nives graves Admonitiones adfert: Valida hiemis ratio per Civitates Americae Unitas incipit Martis movere, graves nives, ventos fortes afferens, et temperaturas per 12 saltem civitates congelatas. Tempestatis Nationalis Service monet ut peregrinatione periculosa fieri possit du…",2026-04-16 04:39:18+00:00
2ce05a6847816735550f11b7536aa3ed,2026-04-07T23:45:30Z,'snow',english.khabarhub.com,en,0.9,"Rain likely across country today, heavier in western regions","KATHMANDU: The Department of Hydrology and Meteorology has urged the public to remain cautious as rain, snowfall, lightning, windstorms, and hail are likely to affect various parts of the country on Wednesday. Meteorologist Rojan Lamichhane from the departmen…",https://english.khabarhub.com/2026/08/543118/,https://english.khabarhub.com/wp-content/uploads/2021/10/Weather-1-e1750897810127.jpg,,"KATHMANDU: The Department of Hydrology and Meteorology has urged the public to remain cautious as rain, snowfall, lightning, windstorms, and hail are likely to affect various parts of the country on … [+1408 chars]",,"Heute ist im ganzen Land mit Regen zu rechnen, in den westlichen Regionen stärker. KATHMANDU: Das Ministerium für Hydrologie und Meteorologie hat die Öffentlichkeit aufgefordert, vorsichtig zu bleiben, da am Mittwoch wahrscheinlich verschiedene Teile des Landes von Regen, Schneefall, Blitzen, Stürmen und Hagel heimgesucht werden. Meteorologe Rojan Lamichhane aus der Abteilung…","Rain likely across country today, heavier in western regions. KATHMANDU: The Department of Hydrology and Meteorology has urged the public to remain cautious as rain, snowfall, lightning, windstorms, and hail are likely to affect various parts of the country on Wednesday. Meteorologist Rojan Lamichhane from the departmen…","Pluet verisimile per patriam hodie graviorem in regionibus occidentalibus. KATHMANDU: Department of Hydrologiae et Meteorologiae publicae hortatus est ut cautiores essent ut pluviae, nix, fulgura, procellae, grandines varias regiones die Mercurii partes afficerent. Meteorologus Rojan Lamichhane ab exitiosis…",2026-04-16 04:39:18+00:00
215fa49898a6f70f293813c4ad8af54f,2026-04-08T09:25:31Z,'snowfall',economictimes.indiatimes.com,en,0.9,"Heavy showers may lead to flash floods, landslides in parts of Kashmir: Met",Fresh snowfall hit Gulmarg and other higher areas in Kashmir on Wednesday. Plains experienced rains. The meteorological department forecasts erratic weather until April 10. Light to moderate rain and snow are expected in higher reaches with thunder and hail. …,https://economictimes.indiatimes.com/news/india/heavy-showers-may-lead-to-flash-floods-landslides-in-parts-of-kashmir-met/articleshow/130108609.cms,"https://img.etimg.com/thumb/msid-130108609,width-1200,height-630,imgsize-513240,overlay-economictimes/articleshow.jpg",,"Srinagar, The popular tourist resort of Gulmarg and few other areas in the higher reaches of Kashmir received fresh snowfall on Wednesday, while rains lashed the plains of the valley, the meteorologi… [+1149 chars]",,Starke Regenfälle können in Teilen Kaschmirs zu Sturzfluten und Erdrutschen führen: Met. Am Mittwoch traf neuer Schneefall Gulmarg und andere höher gelegene Gebiete in Kaschmir. In den Ebenen regnete es. Das Wetteramt prognostiziert bis zum 10. April unberechenbares Wetter. In höheren Lagen werden leichter bis mäßiger Regen und Schnee sowie Donner und Hagel erwartet. …,"Heavy showers may lead to flash floods, landslides in parts of Kashmir: Met. Fresh snowfall hit Gulmarg and other higher areas in Kashmir on Wednesday. Plains experienced rains. The meteorological department forecasts erratic weather until April 10. Light to moderate rain and snow are expected in higher reaches with thunder and hail. …","Imbres graves ducunt ut flumina splendeant, proruit in partes Kashmir: Met. Nova nix Gulmarg et alia superiora loca in Kashmir die mercurii percussit. Campi pluviae periti. Dicasterii meteorologici praenuntiat tempestatem erraticam usque ad diem 10 Aprilis. Lux pluviae et nivis moderandae exspectatur in superioribus cum tonitruo et grandine. ...",2026-04-16 04:39:18+00:00
4ed15a49b5e5de217c3d9372e0c8fe3e,2026-04-08T12:04:49Z,'snow',www.cbc.ca,en,0.9,"Alberta clipper brings spring snowstorm to southern Manitoba, closes several schools",An Alberta clipper brought heavy snow to central and southern areas of the province late Tuesday and into Wednesday.,https://www.cbc.ca/news/canada/manitoba/spring-snowstorm-alberta-clipper-manitoba-9.7155911,"https://i.cbc.ca/ais/ea03aedb-15dd-4701-a5e1-2c25d5e32887,1775647343039/full/max/0/default.jpg?im=Crop%2Crect%3D%280%2C181%2C1225%2C689%29%3BResize%3D620",,"Manitoba's stubborn winter, already overextending its stay, flared up again on Wednesday.
An Alberta clipper brought heavy snow to central and southern areas of the province late Tuesday and into We… [+2278 chars]",,Der Klipper aus Alberta bringt Frühlingsschneesturm in den Süden von Manitoba und schließt mehrere Schulen. Ein Klipper aus Alberta brachte am späten Dienstag und bis in den Mittwoch hinein starken Schneefall in die zentralen und südlichen Gebiete der Provinz.,"Alberta clipper brings spring snowstorm to southern Manitoba, closes several schools. An Alberta clipper brought heavy snow to central and southern areas of the province late Tuesday and into Wednesday.","Alberta retonsor vernum nivis in Manitoba meridionali affert, plures scholas claudit. An Alberta clipper nives ad centrales et meridionales provinciae nuper Martis et Mercurii intulit.",2026-04-16 04:39:18+00:00
dbf372ee1b68cf697e55634394d66798,2026-04-08T12:05:06Z,'snowfall',english.khabarhub.com,en,0.9,"Snowfall hits Mustang, disrupting daily life and travel","MUSTANG: Mustang has experienced its seventh snowfall of the season, with fresh snow reported in Baragung Muktikshetra and Upper Mustang since 11:00 pm on Tuesday night. The district had already witnessed heavy snowfall last Saturday and Monday. Since the fir…",https://english.khabarhub.com/2026/08/543241/,https://english.khabarhub.com/wp-content/uploads/2026/01/muktinath.jpeg,,"MUSTANG: Mustang has experienced its seventh snowfall of the season, with fresh snow reported in Baragung Muktikshetra and Upper Mustang since 11:00 pm on Tuesday night.
The district had already wit… [+678 chars]",,"Schneefall trifft Mustang und stört das tägliche Leben und Reisen. MUSTANG: Mustang hat seinen siebten Schneefall der Saison erlebt, wobei in Baragung Muktikshetra und Upper Mustang seit Dienstagabend, 23:00 Uhr, Neuschnee gemeldet wurde. Bereits am vergangenen Samstag und Montag hatte es im Landkreis starken Schneefall gegeben. Seit der ersten…","Snowfall hits Mustang, disrupting daily life and travel. MUSTANG: Mustang has experienced its seventh snowfall of the season, with fresh snow reported in Baragung Muktikshetra and Upper Mustang since 11:00 pm on Tuesday night. The district had already witnessed heavy snowfall last Saturday and Monday. Since the fir…","Snowfall Mustang pervenit, vitam cotidianam et peregrinationem perturbans. MUSTANG: Mustang septimum nix temporis sui expertus est, cum nova nix nuntiata in Baragung Muktikshetra et Superior Mustang ab 11:00 post meridiem die Martis nocte. Regionem nix gravis Saturni et Lunae proximo iam conspexerat. Cum abies…",2026-04-16 04:39:18+00:00
1c4c168b97b79b4f007dea3fab432777,2026-04-09T01:15:21Z,'snowfall',english.khabarhub.com,en,0.9,Western low pressure system to trigger rain and snowfall,"KATHMANDU: Weather conditions across the country have turned unstable due to the influence of a western low pressure system combined with local winds. According to the Department of Hydrology and Meteorology, light to moderate rainfall accompanied by thunder …",https://english.khabarhub.com/2026/09/543294/,https://english.khabarhub.com/wp-content/uploads/2026/04/Weather-map-April.png,,"KATHMANDU: Weather conditions across the country have turned unstable due to the influence of a western low pressure system combined with local winds.
According to the Department of Hydrology and Me… [+1131 chars]",,"Westliches Tiefdruckgebiet löst Regen und Schneefall aus. KATHMANDU: Die Wetterbedingungen im ganzen Land sind aufgrund des Einflusses eines westlichen Tiefdrucksystems in Kombination mit lokalen Winden instabil geworden. Nach Angaben der Abteilung für Hydrologie und Meteorologie kam es zu leichten bis mäßigen Niederschlägen, begleitet von Gewittern …","Western low pressure system to trigger rain and snowfall. KATHMANDU: Weather conditions across the country have turned unstable due to the influence of a western low pressure system combined with local winds. According to the Department of Hydrology and Meteorology, light to moderate rainfall accompanied by thunder …","Ratio pressionis Occidentis humilis ad trigger pluviam et nix. KATHMANDU: Tempestates per regionem instabiles conversi sunt ob impressionem pressionis occidentalis humilis systematis cum ventis localibus coniuncti. Secundum Department of Hydrologiae et Meteorologiae, lux pluviae moderatae cum tonitruo...",2026-04-16 04:39:18+00:00
bbd3759fed975a2678375186aeb67ce1,2026-04-09T23:41:43Z,'snowfall',www.cbc.ca,en,0.9,Lack of snow in western U.S. driving Americans to Banff's ski resorts,"Banff received large amounts of snow this year, while the western U.S. experienced a snow drought. This has led to more Americans making the trip up to the Bow Valley to ski.",https://www.cbc.ca/news/canada/calgary/americans-skiing-banff-9.7157883,"https://i.cbc.ca/ais/1.6664857,1775776278987/full/max/0/default.jpg?im=Crop%2Crect%3D%280%2C58%2C4032%2C2268%29%3BResize%3D620",,"Luke Glaser, an American skier from Ohio, booked all of his ski trips in the U.S. before the season started this year a decision he now says was a ""big mistake.""
So we went to Colorado and they had … [+2809 chars]",,"Schneemangel im Westen der USA treibt Amerikaner in die Skigebiete von Banff. In Banff fielen dieses Jahr große Schneemengen, während im Westen der USA eine Schneedürre herrschte. Dies hat dazu geführt, dass immer mehr Amerikaner zum Skifahren ins Bow Valley reisen.","Lack of snow in western U.S. driving Americans to Banff's ski resorts. Banff received large amounts of snow this year, while the western U.S. experienced a snow drought. This has led to more Americans making the trip up to the Bow Valley to ski.","Imminuta nivis in Americae occidentis US agitans ad ski Banff frequentat. Banff magnas nives hoc anno accepit, cum Americae occidentis siccitatem nivem expertus est. Hoc magis Americanis induxit ut iter faciens usque ad Vallem Arcum ski.",2026-04-16 04:39:18+00:00
94b2e19944181e9b630672d37d2be386,2026-04-10T09:50:00Z,'snow',www.mediafax.ro,en,0.9,Winter returns to Romania’s mountain roads,"Heavy snow caused traffic problems in mountain areas of Romania, especially in Vâlcea County and around Brașov County, where road crews used plows and anti skid material to keep roads open, while major highways like DN1 and A1 were heavily congested.",https://www.mediafax.ro/english/winter-returns-to-romanias-mountain-roads-23718272,https://www.mediafax.ro//wp-content/uploads/2026/04/craiova-ninsori-1024x503-1.webp,,"Heavy snowfall hit Romanias mountainous regions on Friday, prompting overnight interventions by road crews and causing traffic congestion on several major routes toward the mountains.
Heavy snowfall… [+1886 chars]",,"Der Winter kehrt auf Rumäniens Bergstraßen zurück. Starker Schneefall verursachte Verkehrsprobleme in den Bergregionen Rumäniens, insbesondere im Kreis Vâlcea und rund um den Kreis Brașov, wo Straßenwächter Pflüge und rutschfestes Material einsetzten, um die Straßen offen zu halten, während wichtige Autobahnen wie DN1 und A1 stark verstopft waren.","Winter returns to Romania’s mountain roads. Heavy snow caused traffic problems in mountain areas of Romania, especially in Vâlcea County and around Brașov County, where road crews used plows and anti skid material to keep roads open, while major highways like DN1 and A1 were heavily congested.","Hiems in itinera montis Romaniae redit. Gravis nives negotiationes negotiationes in locis montanis Romaniae, praesertim in Vâlcea Comitatu et circa Comitatus Brașov, causant, ubi nautae via aratra et materia latrinae anti- quitas vias apertas fecerunt, cum viis maioribus sicut DN1 et A1 graviter congestae erant.",2026-04-16 14:23:58+00:00
7adfb6a16184865a4697e5d8f962d0f3,2026-04-13T20:15:15Z,'winter service',gizmodo.com,en,0.2,Of Course That ‘Leaked’ 2026 ‘Winds of Winter’ Release Date Is Fake,George R.R. Martin's publisher has debunked a tweet claiming that the much-anticipated 'A Song of Ice and Fire' entry would arrive this year.,https://gizmodo.com/winds-of-winter-release-date-rumors-2026-game-of-thrones-2000745848,https://gizmodo.com/app/uploads/2026/01/GameofThrones-2-1200x675.jpg,,You can file this one under both internet hoax and “no duh.” A tweet claiming to have insider information regarding the release date of George R.R. Martin’s The Winds of Winter has turned out to be p… [+2158 chars],,"Natürlich ist das durchgesickerte Erscheinungsdatum von „Winds of Winter“ im Jahr 2026 eine Fälschung. Der Verleger von George R.R. Martin hat einen Tweet widerlegt, in dem behauptet wurde, dass der mit Spannung erwartete Beitrag „Das Lied von Eis und Feuer“ dieses Jahr erscheinen würde.",Of Course That ‘Leaked’ 2026 ‘Winds of Winter’ Release Date Is Fake. George R.R. Martin's publisher has debunked a tweet claiming that the much-anticipated 'A Song of Ice and Fire' entry would arrive this year.,Scilicet Quod 'Leaked' 2026 'venti hyemalis' est Fake Date deliberatum. Georgius R.R. editor Martini tweet debunked dixit affirmans multi-anticipatum 'Canticum Ice et Fire' ingressu hoc anno venturum esse.,2026-04-16 19:48:21+00:00
a1191396b8aaf7bd46f3d819d34693b9,2026-04-09T10:25:09Z,'frost weather',www.aljazeera.com,en,0.3,Argentina MPs approve bill allowing mining in glaciers,"Thousands of people have demonstrated against the bill, which scientists and activists say threatens water resources.",https://www.aljazeera.com/news/2026/4/9/argentinas-lawmakers-approve-bill-allowing-mining-in-glaciers,https://www.aljazeera.com/wp-content/uploads/2026/04/afp_69d772472c78-1775727175.jpg?resize=1920%2C1440,,"Argentinian politicians have approved a bill earlier pushed by the countrys right-wing President Javier Milei that authorises mining in ecologically sensitive areas of glaciers and permafrost, a move… [+2748 chars]",,"Argentinische Abgeordnete genehmigen Gesetzesentwurf, der den Bergbau in Gletschern erlaubt. Tausende Menschen haben gegen das Gesetz demonstriert, das laut Wissenschaftlern und Aktivisten die Wasserressourcen gefährdet.","Argentina MPs approve bill allowing mining in glaciers. Thousands of people have demonstrated against the bill, which scientists and activists say threatens water resources.","Argentina MPs probant libellum fodienda in molibus permittens. Milia hominum contra rogationem demonstraverunt, quam physici et actores dicunt opes aquarum minas esse.",2026-04-17 04:36:53+00:00
c3763767f8ec5c09bb8fb43435953094,2026-04-01T11:00:00Z,'snow',www.scientificamerican.com,en,0.9,April 1 snowpack this year is utterly dismal,"A record warm winter meant that snow levels across the western U.S. were already low, but an incredible March heat wave has made things even worse",https://www.scientificamerican.com/article/april-1-snowpack-this-year-is-utterly-dismal/,https://static.scientificamerican.com/dam/asset/6e635f6c-8a0f-4ae8-a6d9-179d906120c3/GettyImages-2268673978_web.jpeg?m=1774997123.692&w=1200,,"The western snowpack is in dire straits. Already, the snowpack that coats the mountains of the western U.S. by this point of the year was dismally low compared with past seasons. Then came the record… [+4791 chars]",,"Die Schneedecke vom 1. April dieses Jahres ist äußerst düster. Ein rekordwarmer Winter bedeutete, dass die Schneemengen im Westen der USA bereits niedrig waren, aber eine unglaubliche Hitzewelle im März hat die Lage noch schlimmer gemacht","April 1 snowpack this year is utterly dismal. A record warm winter meant that snow levels across the western U.S. were already low, but an incredible March heat wave has made things even worse","Aprilis I SnowPack hoc anno est prorsus tristis. Commentarius hiemem calidam significabat quod nix gradus trans US occidentales iam humiles erant, sed incredibilis aestus Martii fluctus res etiam peioras fecit.",2026-04-17 04:36:53+00:00
7a08f5d084535863f5f7a49e816c4424,2026-04-02T18:00:00Z,'snow climate change',www.cbc.ca,en,0.9,Burying burnt wood after wildfires could help the climate,"In this issue of our environmental newsletter, we take a closer look at a low-tech way to remove and lock away carbon; get a view from space of what the western U.S. heat wave did to the snow; and see what China's EV transition looks like on the ground.",https://www.cbc.ca/news/climate/what-on-earth-carbon-burial-9.7151558,"https://i.cbc.ca/ais/74c893c1-0bdd-4800-85af-c9e2748fa931,1773445694268/full/max/0/default.jpg?im=Crop%2Crect%3D%2822%2C0%2C1623%2C912%29%3BResize%3D620",,"Welcome to our weekly newsletter where we highlight environmental trends and solutions that are moving us to a more sustainable world.
Im Nick Logan and I spent plenty of time as a kid digging holes… [+16113 chars]",,"Das Vergraben von verbranntem Holz nach Waldbränden könnte dem Klima helfen. In dieser Ausgabe unseres Umwelt-Newsletters werfen wir einen genaueren Blick auf eine Low-Tech-Methode zur Entfernung und Bindung von Kohlenstoff; Erhalten Sie aus dem Weltraum einen Einblick in die Auswirkungen der Hitzewelle im Westen der USA auf den Schnee. und sehen Sie, wie Chinas Umstellung auf Elektrofahrzeuge vor Ort aussieht.","Burying burnt wood after wildfires could help the climate. In this issue of our environmental newsletter, we take a closer look at a low-tech way to remove and lock away carbon; get a view from space of what the western U.S. heat wave did to the snow; and see what China's EV transition looks like on the ground.","Lignum incensum post incendia sepeliendi clima iuvare poterant. In hoc casu nostro tabellarii environmentalis, propius inspicimus viam humilem technicam ad removendum et carbo claudendum; spectes e spatio quod occidentis US aestus ad nivem undam fecerit; et vide quid eV Sinarum transitus similis in terra spectat.",2026-04-17 04:36:53+00:00
