index,published,keyword,domain,language,valid,title,description,url,image,archive,content,quote,de,en,la,added
13ca21f7eebd05f52fcee8bb3a1b878d,2026-04-11T15:33:50Z,'slippery roads',www.the-independent.com,en,0.3,Born to rage in the USA: Bruce Springsteen’s lifelong protest in song — from Vietnam to Trump,"The Boss has kicked off his current US tour with a string of fiery broadsides against President Trump, but this is far from the first time he’s weighed in on political issues. Kevin E G Perry looks back at Springsteen’s long history of outspoken advocacy",https://www.the-independent.com/arts-entertainment/music/features/bruce-springsteen-politics-trump-vietnam-b2951616.html,https://static.the-independent.com/2026/04/10/16/30/Bruce-Springsteen-has-a-long-history-of-outspoken-political-activism-on-and-off-stage.jpeg?width=1200&height=800&crop=1200:800,,"Your support helps us to tell the story
From reproductive rights to climate change to Big Tech, The Independent is on the ground when the story is developing. Whether it's investigating the financia… [+8850 chars]",,"Geboren, um in den USA zu toben: Bruce Springsteens lebenslanger Protest in Liedern – von Vietnam bis Trump. Der Boss hat seine aktuelle US-Tournee mit einer Reihe heftiger Seitenhiebe gegen Präsident Trump begonnen, aber dies ist bei weitem nicht das erste Mal, dass er sich zu politischen Themen äußert. Kevin E. G. Perry blickt auf Springsteens lange Geschichte offener Fürsprache zurück","Born to rage in the USA: Bruce Springsteen’s lifelong protest in song — from Vietnam to Trump. The Boss has kicked off his current US tour with a string of fiery broadsides against President Trump, but this is far from the first time he’s weighed in on political issues. Kevin E G Perry looks back at Springsteen’s long history of outspoken advocacy","Natus saevire in USA: recusatio vitae Brus Springsteen in cantu - a Vietnam ad Trump. Boss suum currentem US Peregrinationem cum filo latitudinis igneae contra Praesidem Trump calce fecit, sed hoc longe a primo tempore in rebus politicis expendit. Kevin E G Perry longam historiam de advocatione libere spectat",2026-04-14 08:40:05+00:00
a8ae247f8a533b9c67c75ebee71179eb,2026-04-11T15:22:53Z,'snow',comicbookmovie.com,en,0.7,The Hunger Games: The Sunrise On The Reaping Preview Reveals New Take On Familiar Faces,"New footage from The Hunger Games: The Sunrise on the Reaping has been released, and it reveals a fresh take on several familiar faces from the wider franchise, including Ralph Fiennes' President Snow.",https://comicbookmovie.com/sci_fi/the-hunger-games-the-sunrise-on-the-reaping-preview-reveals-new-take-on-familiar-faces-a227287,https://comicbookmovie.com/images/articles/banners/the-hunger-games-the-sunrise-on-the-reaping-preview-reveals-new-take-on-familiar-faces-ab227287.jpg,,"Ahead of its release in theaters this November, new footage from The Hunger Games: The Sunrise on the Reaping has found its way online today (via SFFGazette.com). 
In the surprise sneak peek, we get… [+2696 chars]",,"Die Vorschau auf „Die Tribute von Panem: The Sunrise On The Reaping“ enthüllt eine neue Interpretation bekannter Gesichter. Neues Filmmaterial von „Die Tribute von Panem – Der Sonnenaufgang über der Ernte“ wurde veröffentlicht und zeigt eine neue Sicht auf mehrere bekannte Gesichter aus dem gesamten Franchise, darunter Ralph Fiennes‘ Präsident Snow.","The Hunger Games: The Sunrise On The Reaping Preview Reveals New Take On Familiar Faces. New footage from The Hunger Games: The Sunrise on the Reaping has been released, and it reveals a fresh take on several familiar faces from the wider franchise, including Ralph Fiennes' President Snow.","Fames ludi: Ortus metendi Praevius Reveals Novae Faces Familiares Accipe. Novus pedis pedis e Ludis Fames: Ortus metere dimissus est, et revelat nova induere varias notas facies ex ampliore libertate, in quibus Radulphus Fiennes Praeses Nivis.",2026-04-14 08:40:05+00:00
79200e3cbf445cf86566d137d0e44378,2026-04-11T06:07:18Z,'snow',post.rlsbb.to,en,0.9,SNOWBALL EARTH S01E02 720p WEB H264-SKYANiME,"Note: In Japanese With English Selectable Subtitles or (HERE).Season 1, Episode 02 – “Encounters”The world outside the escape pod is covered in snow and ice, and devoid of life. Tetsuo sets off to find human survivors, his promise to Yukio on his mind. Riding…",https://post.rlsbb.to/snowball-earth-s01e02-720p-web-h264-skyanime/,,,"Note: In Japanese With English Selectable Subtitles or (HERE).
Season 1, Episode 02 “Encounters”The world outside the escape pod is covered in snow and ice, and devoid of life. Tetsuo sets off to fi… [+615 chars]",,"SNOWBALL EARTH S01E02 720p WEB H264-SKYANiME. Hinweis: Auf Japanisch mit wählbaren englischen Untertiteln oder (HIER). Staffel 1, Folge 02 – „Begegnungen“ Die Welt außerhalb der Rettungskapsel ist mit Schnee und Eis bedeckt und ohne Leben. Tetsuo macht sich auf die Suche nach menschlichen Überlebenden, sein Versprechen gegenüber Yukio im Kopf. Reiten…","SNOWBALL EARTH S01E02 720p WEB H264-SKYANiME. Note: In Japanese With English Selectable Subtitles or (HERE).Season 1, Episode 02 – “Encounters”The world outside the escape pod is covered in snow and ice, and devoid of life. Tetsuo sets off to find human survivors, his promise to Yukio on his mind. Riding…","Terra S01E02 720p VUL H264-SKYANiME. Nota: In Iaponica Cum Subtitulis selectis Anglicis seu (HERE). Temporum 1, Episode 02 - ""Concursus"" Mundus extra vasculum effugium nive et glacie coopertum est et vita carens. Tetsuo proficiscitur ad inveniendos homines superstites, pollicitationem suam Yukio in animo suo. Equitantes…",2026-04-14 08:40:05+00:00
0fe0e5c9eb7639df736cf023a02d5107,2026-04-11T11:00:00Z,'snow',www.cbc.ca,en,0.9,"Flin Flon snow lodge shuts down for spring, will return next winter","Flin Flon's snow lodge is gone for the season, but those responsible for building the structure are calling it a red-hot success. The ice-and-snow building was knocked down this week after crowds came from near and far to see it.",https://www.cbc.ca/news/canada/manitoba/flin-flon-snow-lodge-closes-9.7160007,"https://i.cbc.ca/ais/1fb65cdb-d2e7-4ff5-9797-2e5b1774147d,1775860184722/full/max/0/default.jpg?im=Crop%2Crect%3D%280%2C285%2C4240%2C2385%29%3BResize%3D620",,"Flin Flon's snow lodge is gone for the season, but those responsible for building the structure are calling it a red-hot success.
The ice-and-snow building, inspired by the famed Icehotel in norther… [+4028 chars]",,"Die Flin Flon-Schneehütte wird im Frühjahr geschlossen und wird im nächsten Winter zurückkehren. Flin Flons Schneehütte steht für diese Saison nicht mehr zur Verfügung, aber die Verantwortlichen für den Bau sprechen von einem glühenden Erfolg. Das aus Eis und Schnee bestehende Gebäude wurde diese Woche abgerissen, nachdem Menschenmengen aus nah und fern angereist waren, um es zu besichtigen.","Flin Flon snow lodge shuts down for spring, will return next winter. Flin Flon's snow lodge is gone for the season, but those responsible for building the structure are calling it a red-hot success. The ice-and-snow building was knocked down this week after crowds came from near and far to see it.","Flin Flon nix tugurium claudit pro ver, altera bruma redibit. Nives delubra Flin Flon pro tempore profecta sunt, sed illi qui structurae structurae auctores eam candenti successu vocant. Glacies et nivis aedificium hac septimana addictum est postquam turbae e propinquo venerunt et procul videbant.",2026-04-14 08:40:05+00:00
0316155476e3adfbcb739e94d57c3ce7,2026-04-03T05:37:38Z,'snow',newsonjapan.com,en,0.9,Unseasonal Heavy Snow Hits Hokkaido,"An unseasonal heavy snowfall struck Hokkaido, with Kushiro City recording a record 21 centimeters of snow for April, while rising temperatures on April 3rd prompted warnings over falling snow from rooftops. (News On Japan)",https://newsonjapan.com/article/148806.php,https://i2.ytimg.com/vi/8w1uGEqwF5U/mqdefault.jpg,,"HOKKAIDO, Apr 03 (News On Japan) -
 An unseasonal heavy snowfall struck Hokkaido, with Kushiro City recording a record 21 centimeters of snow for April, while rising temperatures on April 3rd prompt… [+582 chars]",,"Ungewöhnlich starker Schneefall trifft Hokkaido. Ein ungewöhnlich heftiger Schneefall ereignete sich in Hokkaido, wobei die Stadt Kushiro im April eine Rekordschneemenge von 21 Zentimetern verzeichnete, während steigende Temperaturen am 3. April zu Warnungen über fallenden Schnee von Dächern führten. (Neuigkeiten über Japan)","Unseasonal Heavy Snow Hits Hokkaido. An unseasonal heavy snowfall struck Hokkaido, with Kushiro City recording a record 21 centimeters of snow for April, while rising temperatures on April 3rd prompted warnings over falling snow from rooftops. (News On Japan)","Intempestivi Gravis Nivis Hits Hokkaido. Hokkaido gravis nix intempestiva percussus est, cum Kushiro City in memoriam 21 centimetra nivis pro Aprili rettulit, cum temperaturas surgens die 3 Aprilis monita super nives e tectorum cadentibus suasit. (News On Japan)",2026-04-14 14:22:04+00:00
8a41aabadb9abda9b58150ef030e1c31,2026-04-03T18:46:40Z,'snow',timesofindia.indiatimes.com,en,0.9,"MeT forecasts heavy rains in Kashmir plains, snowfall in higher reaches","Jammu and Kashmir braces for continued erratic weather as a strong western disturbance brings widespread rain, gusty winds, and snowfall to higher reaches. Srinagar experienced flooded roads, prompting authorities to issue advisories urging residents to avoid…",https://timesofindia.indiatimes.com/india/met-forecasts-heavy-rains-in-kashmir-plains-snowfall-in-higher-reaches/articleshow/130007938.cms,"https://static.toiimg.com/thumb/msid-130008398,width-1280,height-720,imgsize-284366,resizemode-6,overlay-toi_sw,pt-32,y_pad-600/photo.jpg",,"<ul><li>News</li>
<li>India News</li>
<li>MeT forecasts heavy rains in Kashmir plains, snowfall in higher reaches</li></ul>
Follow Us On Social Media
Copyright © 2026 Bennett, Coleman &amp; Co. L… [+69 chars]",,"MeT prognostiziert starke Regenfälle in der Kaschmir-Ebene und Schneefall in höheren Lagen. Jammu und Kashmir bereiten sich auf weiterhin unberechenbares Wetter vor, da eine starke westliche Störung ausgedehnten Regen, böige Winde und Schneefall in höher gelegene Gebiete bringt. In Srinagar kam es zu überfluteten Straßen, was die Behörden dazu veranlasste, Warnhinweise herauszugeben, in denen sie die Bewohner aufforderten, …","MeT forecasts heavy rains in Kashmir plains, snowfall in higher reaches. Jammu and Kashmir braces for continued erratic weather as a strong western disturbance brings widespread rain, gusty winds, and snowfall to higher reaches. Srinagar experienced flooded roads, prompting authorities to issue advisories urging residents to avoid…","MeT praenuntiat pluvias in campis Kashmir, nix in altioribus attingit. Jammu et Kashmir adstringit tempestates erraticae continuas sicut fortis commotio occidentis pluviam, ventos procellosos, et nix ad altiora pervenit. Caule peritis inundatis viae, auctoritatibus monitis ad consilia suadendi habitantes ad vitandum…",2026-04-14 14:22:04+00:00
6e644871b58c82a08d1c5724e7a95097,2026-04-05T06:00:00Z,'snowfall',fcbayern.com,en,0.9,Fan views ahead of Real Madrid: ‘We can do it!’,"Once again, it was nothing short of amazing. Despite temperatures just above freezing and light snowfall, over 2,000 fans turned up at Säbener Straße last Tuesday to watch Bayern’s open training s...",https://fcbayern.com/en/news/2026/04/bayern-fan-views-ahead-of-champions-league-tie-at-real-madrid,https://s.yimg.com/cv/apiv2/sports/share/PD_010626-Social_Share_GENRIC_YAHOO_SPORTS-1200x630.jpg,,"Once again, it was nothing short of amazing. Despite temperatures just above freezing and light snowfall, over 2,000 fans turned up at Säbener Straße last Tuesday to watch Bayerns open training sessi… [+3369 chars]",,"Fanstimmen vor Real Madrid: „Wir schaffen das!“ Wieder einmal war es einfach nur erstaunlich. Trotz Temperaturen knapp über dem Gefrierpunkt und leichtem Schneefall kamen am vergangenen Dienstag über 2.000 Fans an die Säbener Straße, um das offene Training der Bayern zu verfolgen...","Fan views ahead of Real Madrid: ‘We can do it!’. Once again, it was nothing short of amazing. Despite temperatures just above freezing and light snowfall, over 2,000 fans turned up at Säbener Straße last Tuesday to watch Bayern’s open training s...","Sententias ventilationis praemisit de Real Madrid: 'Hoc facere possumus!'. Iterum nihil minus mirabile fuit. Quamvis temperaturas modo supra nivalem nixam et levem, supra 2,000 fans in Säbener Straße ultimo die Martis versa est ad speculandum Bayern apertam institutionem...",2026-04-14 14:22:04+00:00
794bc5533c9f9719157f036811378109,2026-04-06T18:12:47Z,'snow',www.cbc.ca,en,0.9,"High winds expected on B.C.'s southern coast, snowfall warning issued for Peace region","The City of Trail reached 23 C on Sunday, breaking the old mark of 21.7 C set in 1966.",https://www.cbc.ca/news/canada/british-columbia/windy-south-coast-snow-peace-region-bc-temp-records-9.7154158,"https://i.cbc.ca/ais/6b8f11ca-4bff-449d-99ab-a3f93245d345,1775497554948/full/max/0/default.jpg?im=Crop%2Crect%3D%280%2C172%2C3300%2C1856%29%3BResize%3D620",,"Spring weather in British Columbia brought record-high daily temperatures to several communities, while an arriving cold front is expected to bring strong winds to southwestern parts of the province.… [+906 chars]",,"An der Südküste von B.C. werden starke Winde erwartet, für die Friedensregion wird eine Schneefallwarnung ausgegeben. Die Stadt Trail erreichte am Sonntag 23 °C und übertraf damit die alte Marke von 21,7 °C aus dem Jahr 1966.","High winds expected on B.C.'s southern coast, snowfall warning issued for Peace region. The City of Trail reached 23 C on Sunday, breaking the old mark of 21.7 C set in 1966.","Venti exspectantur in B.C. in oram meridionali, nix monitio pro regione Pacis edita. Urbs Trail pervenit 23 C die Dominico, solvens vetus vestigium 21.7 C anno 1966 positum.",2026-04-14 14:22:04+00:00
5d1033a01f409052ed6b6e2d0d0856d5,2026-04-07T16:51:03Z,'snowfall',www.bbc.com,en,0.9,Scotland's hottest day of 2026 just two days after snowfall,Scotland's Spring weather proves unpredictable as the country experiences snow and sunshine in two days.,https://www.bbc.com/news/articles/cx29prnkl3go,https://ichef.bbci.co.uk/news/1024/branded_news/a510/live/ab192420-329a-11f1-8cba-9df81803c83c.jpg,,"It was also the warmest day of the year in England, Wales and Northern Ireland, according to the Met Office.",,"Schottlands heißester Tag im Jahr 2026, nur zwei Tage nach dem Schneefall. Schottlands Frühlingswetter erweist sich als unvorhersehbar, da das Land innerhalb von zwei Tagen Schnee und Sonnenschein erlebt.",Scotland's hottest day of 2026 just two days after snowfall. Scotland's Spring weather proves unpredictable as the country experiences snow and sunshine in two days.,"Calidissimus dies Scotiae MMXXVI duobus diebus post nix. Veris tempestas Scotiae vagus probat, quod terra in duobus diebus nix et soles patitur.",2026-04-14 14:22:04+00:00
9f51b46fe1e1cdfb3b41d8079dc9144d,2026-04-08T05:23:39Z,'snowfall',www.hurriyetdailynews.com,en,0.9,Mount Nemrut welcomes season’s first visitors,"After winter road closures due to heavy snowfall, the colossal statues of the Kommagene Kingdom at Mount Nemrut have reopened to visitors at an altitude of 2,150 meters.",https://www.hurriyetdailynews.com/mount-nemrut-welcomes-seasons-first-visitors-220744,https://image.hurimg.com/i/hurriyet/75/200x200/69d575e1fd0cf081c7fd1f5f.jpg,,"ADIYAMAN
After winter road closures due to heavy snowfall, the colossal statues of the Kommagene Kingdom at Mount Nemrut have reopened to visitors at an altitude of 2,150 meters.
Renowned for offer… [+1883 chars]",,Mount Nemrut heißt die ersten Besucher der Saison willkommen. Nach winterlichen Straßensperrungen aufgrund starker Schneefälle sind die kolossalen Statuen des Kommagene-Königreichs am Berg Nemrut auf einer Höhe von 2.150 Metern wieder für Besucher geöffnet.,"Mount Nemrut welcomes season’s first visitors. After winter road closures due to heavy snowfall, the colossal statues of the Kommagene Kingdom at Mount Nemrut have reopened to visitors at an altitude of 2,150 meters.","Mons Nemrut primos visitatores recipit tempus. Post viae hiemales clausuras propter nix gravem, statuae colosseae regni Kommagenae apud Montem Nemrut visitatoribus altitudinem 2,150 metrorum aperuerunt.",2026-04-14 14:22:04+00:00
d20dd3fca61b589ad919c94cb30b514f,2026-04-09T17:07:04Z,'snowfall',nypost.com,en,0.9,Central Park’s showstopping cherry blooms are having a ‘really good’ season – thanks to record-setting snowfall,"A horrible winter is turning into a cherry nice surprise! The winter may have been brutal, but it’s going to have a beautiful payoff this spring — as the snowy season is leading to an especially bright blooming of cherry blossoms this spring, according to Cen…",https://nypost.com/2026/04/09/us-news/central-parks-showstopping-cherry-blooms-are-having-a-really-good-season-thanks-to-record-setting-snowfall/,https://nypost.com/wp-content/uploads/sites/2/2026/04/newspress-collage-ou0qgksv2-1775682005556.jpg?quality=75&strip=all&1775667613&w=1200,,"A horrible winter is turning into a cherry nice surprise!
The winter may have been brutal, but it’s going to have a beautiful payoff this spring — as the snowy season is leading to an especially bri… [+3608 chars]",,"Die atemberaubenden Kirschblüten im Central Park haben eine „wirklich gute“ Saison – dank rekordverdächtiger Schneefälle. Ein schrecklicher Winter verwandelt sich in eine wirklich schöne Überraschung! Der Winter mag brutal gewesen sein, aber er wird sich in diesem Frühling wunderbar auszahlen – denn die schneereiche Jahreszeit führt laut Cen zu einer besonders leuchtenden Blüte der Kirschblüten in diesem Frühling …","Central Park’s showstopping cherry blooms are having a ‘really good’ season – thanks to record-setting snowfall. A horrible winter is turning into a cherry nice surprise! The winter may have been brutal, but it’s going to have a beautiful payoff this spring — as the snowy season is leading to an especially bright blooming of cherry blossoms this spring, according to Cen…","Central Park spectacula cerasorum florere habent tempus vere bonum - nix record-positionis. Hiems horrenda in cerasos versatur delicatus mirum! Hiems fortasse truculenta fuit, sed pulchram payoff hoc vere habiturus est — sicut tempus nivale maxime nitidissimum fert floris cerasi huius ver, secundum Cen…",2026-04-14 14:22:04+00:00
6a6223208e3d662b7059781ce0e6c400,2026-04-10T23:52:55Z,'snow',nypost.com,en,0.9,Skiers rejoice as late-season snowstorm to dump several feet of powder on California resorts — here’s where to find it,"The storm will roll in Friday evening, gather strength overnight, and reach its snowy peak from Saturday night into Sunday when the heaviest flakes are expected.",https://nypost.com/2026/04/10/us-news/skiers-rejoice-as-late-season-snowstorm-to-dump-several-feet-of-powder-on-california-resorts/,https://nypost.com/wp-content/uploads/sites/2/2026/04/125395267.jpg?quality=75&strip=all&w=1200,,"Californias ski season was fading fast, but now a late-season miracle storm is swooping in to breathe new life into the slopes.
The storm will roll in Friday evening, gather strength overnight, and … [+1932 chars]",,"Skifahrer freuen sich, als der Schneesturm in der Spätsaison mehrere Fuß Pulverschnee über kalifornische Skigebiete wirft – hier finden Sie ihn. Der Sturm wird am Freitagabend hereinrollen, über Nacht an Stärke gewinnen und von Samstagnacht bis Sonntag seinen schneebedeckten Höhepunkt erreichen, wenn die schwersten Flocken erwartet werden.","Skiers rejoice as late-season snowstorm to dump several feet of powder on California resorts — here’s where to find it. The storm will roll in Friday evening, gather strength overnight, and reach its snowy peak from Saturday night into Sunday when the heaviest flakes are expected.","Skiers gaudent pro tempore nives tempestatis ad effundendum aliquot pedes pulveris in California frequentatum — hic est ubi eam reperies. Tempestas vespere Veneris involvet, pernoctare vires colliget, et nivalem apicem e Nocte Saturni in Dominicam perveniet, cum gravissimae carnium exspectantur.",2026-04-14 14:22:04+00:00
3d2fefbb4863bc9d96d8bc56c3faba89,2026-04-13T14:59:22Z,'slippery roads',www.the-independent.com,en,0.3,Bruce Springsteen’s anthems of resistance: From Vietnam to Tump,"The Boss has kicked off his current US tour with a string of fiery broadsides against President Trump, but this is far from the first time he’s weighed in on political issues. Kevin E G Perry looks back at Springsteen’s long history of outspoken advocacy",https://www.the-independent.com/arts-entertainment/music/features/bruce-springsteen-trump-political-history-b2956701.html,https://static.the-independent.com/2026/04/10/16/30/Bruce-Springsteen-has-a-long-history-of-outspoken-political-activism-on-and-off-stage.jpeg?width=1200&height=800&crop=1200:800,,"Your support helps us to tell the story
From reproductive rights to climate change to Big Tech, The Independent is on the ground when the story is developing. Whether it's investigating the financia… [+8850 chars]",,"Bruce Springsteens Hymnen des Widerstands: Von Vietnam bis Tump. Der Boss hat seine aktuelle US-Tournee mit einer Reihe heftiger Seitenhiebe gegen Präsident Trump begonnen, aber dies ist bei weitem nicht das erste Mal, dass er sich zu politischen Themen äußert. Kevin E. G. Perry blickt auf Springsteens lange Geschichte offener Fürsprache zurück","Bruce Springsteen’s anthems of resistance: From Vietnam to Tump. The Boss has kicked off his current US tour with a string of fiery broadsides against President Trump, but this is far from the first time he’s weighed in on political issues. Kevin E G Perry looks back at Springsteen’s long history of outspoken advocacy","Bruce Springsteen antiphonae resistendi: From Vietnam ad Tump. Boss suum currentem US Peregrinationem cum filo latitudinis igneae contra Praesidem Trump calce fecit, sed hoc longe a primo tempore in rebus politicis expendit. Kevin E G Perry longam historiam de advocatione libere spectat",2026-04-14 19:51:21+00:00
121413a81a17374b8398431d964839a5,2026-04-13T18:22:56Z,'slippery roads',www.cbc.ca,en,0.3,"Ban's out, spring's in. Parking restrictions lifted in St. John's","The ban was originally extended until April 18 as the chance of wintry weather continued, but the city announced on Monday that the parking ban was lifted effective 7:30 a.m. that morning.",https://www.cbc.ca/news/canada/newfoundland-labrador/st-johns-parking-ban-lifted-9.7161888,"https://i.cbc.ca/ais/1.5495533,1584037784000/full/max/0/default.jpg?im=Crop%2Crect%3D%280%2C0%2C3996%2C2247%29%3BResize%3D620",,"It's a sign of warmer days ahead: The City of St. John's has lifted its overnight parking ban.
The ban had been in place since January to allow for snow crews to safely manage roads in winter weathe… [+624 chars]",,"Das Verbot ist raus, der Frühling ist da. Die Parkbeschränkungen in St. John's wurden aufgehoben. Das Parkverbot wurde ursprünglich bis zum 18. April verlängert, da die Möglichkeit des winterlichen Wetters anhielt, doch die Stadt gab am Montag bekannt, dass das Parkverbot mit Wirkung um 7:30 Uhr morgens aufgehoben wurde.","Ban's out, spring's in. Parking restrictions lifted in St. John's. The ban was originally extended until April 18 as the chance of wintry weather continued, but the city announced on Monday that the parking ban was lifted effective 7:30 a.m. that morning.","Ban's de, fons in. Raedam restrictiones levavi in ​​S. John's. Bannum originaliter prolatum est usque ad diem 18 Aprilis sicut tempestas hiemalis continuata est, sed urbs die Lunae denuntiavit bannum raedam efficacem die illo mane levatum esse.",2026-04-14 19:51:21+00:00
910ed75643cf07a864bba99b2bcae051,2026-04-13T15:45:25Z,'snow',consent.yahoo.com,en,0.7,"Iowa football offers rapid riser, 2029 TE Caiden Snow",Iowa football has entered the mix for an already highly-sought after 2029 tight end prospect.,https://consent.yahoo.com/v2/collectConsent?sessionId=1_cc-session_2f66470c-2d1f-4b82-91bc-46bdcd370c1f,,,"If you click 'Accept all', we and our partners, including 251 who are part of the IAB Transparency &amp; Consent Framework, will also store and / or access information on a device (in other words, us… [+1046 chars]",,Iowa Football bietet den Schnellaufsteiger 2029 TE Caiden Snow. Iowa Football hat sich für einen bereits heiß begehrten Tight-End-Kandidaten im Jahr 2029 angemeldet.,"Iowa football offers rapid riser, 2029 TE Caiden Snow. Iowa football has entered the mix for an already highly-sought after 2029 tight end prospect.","Iowa eu praebet rapidum surgentem, 2029 TE Caiden Nix. Iowa eu intravit misce quia iam summe quaesita est post 2029 finem strictum prospectum.",2026-04-14 19:51:21+00:00
