index,published,keyword,domain,language,valid,title,description,url,image,archive,content,quote
836751a23138a8eb35b97522eba347d0,2025-10-26T15:43:30Z,'snow',www.abc4.com,en,0.0,"Snowfall expected across northern Utah, Winter Weather Advisory in effect","Snowfall is expected across much of northern Utah on Sunday, according to the National Weather Service (NWS).",https://www.abc4.com/weather/winter-weather-northern-utah/,https://media.zenfs.com/en/ktvx_articles_781/352f5af924f33c1ba57316ce33f605d1,,"SALT LAKE CITY (ABC4) Snowfall is expected across much of northern Utah on Sunday, according to the National Weather Service (NWS).
A Winter Weather Advisory is in effect from noon Sunday through no… [+898 chars]",
7749851df99153591a0461c6d8fc9042,2025-10-26T17:06:19Z,'snow',abcnews.go.com,en,0.0,WATCH: Snow leopard cub treated to first pumpkin at Michigan zoo,A snow leopard cub named Juniper was treated to her first pumpkin during Halloween-themed enrichment at the John Ball Zoo in Michigan.,https://abcnews.go.com/US/video/snow-leopard-cub-treated-pumpkin-michigan-zoo-126878949,https://i.abcnewsfe.com/a/e4ece358-5c37-4f07-b094-f5233648474b/251026_abc_social_pumpkin_snow_leopard_hpMain_9x16.jpg?w=992,,"<ul><li>Trump arrives in Asia for talks with world leaders, including China's Xi
</li><li>2 suspects arrested in relation to Louvre heist: French police
</li><li>Shutdown impacts mount as paychecks… [+4504 chars]",
87df5be2d4852c5f81bdbebbb9a4f431,2025-10-27T13:02:39Z,'frost weather',biztoc.com,en,0.0,Thousands Face Plummeting Subfreezing Conditions In 7 States,"Residents in Ohio, New York, New Jersey, Connecticut, Pennsylvania, California, and Utah are facing icy conditions as the National Weather Service (NWS) has issued freeze warnings across parts of these states.
Why It Matters
The NWS cautions that frost and fr…",https://biztoc.com/x/6f3f2b7849d3c3ab,https://biztoc.com/cdn/6f3f2b7849d3c3ab_s.webp,,"Residents in Ohio, New York, New Jersey, Connecticut, Pennsylvania, California, and Utah are facing icy conditions as the National Weather Service (NWS) has issued freeze warnings across parts of the… [+143 chars]",
c2a8192fa50e1736d6590abae37db59e,2025-10-28T00:16:19Z,'snow',www.theweathernetwork.com,en,0.0,"Storm on deck for B.C. could swing through with impactful winds, alpine snow","A vigorous low approaching the B.C. coast on Tuesday will generate intense, possibly damaging winds and waves, alongside heavy alpine snow for the mountain...",https://www.theweathernetwork.com/ca/news/article/storm-on-deck-for-b-c-could-swing-through-with-impactful-winds-alpine-snow,https://s.yimg.com/ny/api/res/1.2/M8LMtC3uAgmSN9OrsWhu6w--/YXBwaWQ9aGlnaGxhbmRlcjt3PTEyMDA7aD02Nzg7Y2Y9d2VicA--/https://media.zenfs.com/en/the_weather_network_616/ceff02d1c105430ec6d7dce39b2936be,,"B.C. can expect more stormy weather this week as an active pattern sticks around, with unsettled conditions anticipated in the days up to and on Halloween, too--and beyond.
A powerful Pacific storm … [+3255 chars]",
ee0b105c45f83ed29a956a4cbd22b51b,2025-10-28T05:34:06Z,'slippery roads',english.khabarhub.com,en,0.0,"Season’s first snowfall hits Mustang, travel above Kagbeni discouraged","MUSTANG: The Himalayan district of Mustang witnessed this season’s first snowfall on Tuesday morning, affecting normal life in the upper region. According to the District Administration Office, snowfall began early today in Korala, Lomanthang, and Muktinath a…",https://english.khabarhub.com/2025/28/503170/,https://english.khabarhub.com/wp-content/uploads/2025/10/mustang-snow.jpg,,"MUSTANG: The Himalayan district of Mustang witnessed this seasons first snowfall on Tuesday morning, affecting normal life in the upper region.
According to the District Administration Office, snowf… [+1167 chars]",
e1504b657d4b3cb6f3d5d5c8f4504115,2025-10-28T07:15:49Z,'snow',english.khabarhub.com,en,0.0,Heavy snow forces suspension of Annapurna Base Camp trekking,"MYAGDI: Light rainfall accompanied by snowfall has disrupted tourism activities in Myagdi and Mustang districts, leaving trekkers stranded along popular mountain routes including the Annapurna Base Camp trail. According to officials, snowfall since last night…",https://english.khabarhub.com/2025/28/503178/,https://english.khabarhub.com/wp-content/uploads/2020/01/Annapurna_Base_camp.jpg,,"MYAGDI: Light rainfall accompanied by snowfall has disrupted tourism activities in Myagdi and Mustang districts, leaving trekkers stranded along popular mountain routes including the Annapurna Base C… [+1846 chars]",
75a2cd5d3e3be7e54c00d500d402b4cd,2025-10-28T10:15:00Z,'winter service',www.outdoorguide.com,en,0.0,Winter Is On The Way. Here's What The NOAA Forecast Is Predicting For The Season,"As winter approaches, everyone has a long-term weather outlook. The National Weather Service has good news for winter fans in the northern part of the US.",https://www.outdoorguide.com/2003553/noaa-winter-weather-forecast-what-to-know/,https://s.yimg.com/ny/api/res/1.2/B2tu2kyYl1.C2.i1lPWkhw--/YXBwaWQ9aGlnaGxhbmRlcjt3PTEyMDA7aD02NzU7Y2Y9d2VicA--/https://media.zenfs.com/en/outdoor_guide_982/41f68cb426c296c56aa149ba6b7f7592,,"We may receive a commission on purchases made from links.
With fall underway, winter weather forecasts are rapidly being released, including the annual winter forecast from the National Oceanic and … [+3904 chars]",
c946cd0cd3eb4867d1fd6be538147a69,2025-10-28T11:02:27Z,'snow',www.fox29.com,en,0.0,Philadelphia Winter 2025-2026: Here's how snowy and cold this winter could be,"Winter is on the way! So, how much snow will we get? Will we have a white Christmas? How cold will this winter be? The FOX 29 Weather Authority answers all...",https://www.fox29.com/weather/philadelphia-winter-2025-2026-how-much-snow,https://s.yimg.com/ny/api/res/1.2/t19Z6Zltg4pKvbrOzvvUdQ--/YXBwaWQ9aGlnaGxhbmRlcjt3PTEyMDA7aD02NzU7Y2Y9d2VicA--/https://media.zenfs.com/en/wtxf_fox_local_articles_571/96e7dbcce52e83787d188736bf243fac,,"The Brief
<ul><li>A weak, early winter La Niña will lead to milder temperatures this winter as it influences the storm track.
</li><li>Conditions are expected to change later in the winter when La … [+3323 chars]",
b0a873d96e3c44963b51188535b35f83,2025-10-28T13:47:12Z,'snow',www.bbc.com,en,0.0,Iceland v Northern Ireland postponed due to snow,Northern Ireland's Nations League promotion/relegation play-off second leg in Iceland is postponed because of heavy snow.,https://www.bbc.com/sport/football/articles/cqjwyv1v51no,https://ichef.bbci.co.uk/ace/branded_sport/1200/cpsprodpb/c700/live/b82f9b20-b401-11f0-a6f4-9daf525f5af5.jpg,http://web.archive.org/web/20251029002730/https://www.bbc.com/sport/football/articles/cqjwyv1v51no,"Northern Ireland's Nations League promotion/relegation play-off second leg in Iceland has been postponed because of heavy snow. 
The game was scheduled to take place at Laugardalsvollur Stadium in R… [+856 chars]",
f8ecd750d57e3617ca0a8306322b1f9c,2025-10-28T16:15:20Z,'slippery roads',english.khabarhub.com,en,0.1,Today’s News in a Nutshell,"KATHMANDU: Khabarhub brings you a glimpse of major developments of the day in Nepal, including politics, business/economy, sports, entertainment, and more. Samyukta Sangharsha Samiti Nepal protests inside police cordon at Maitighar The Samyukta Sangharsha Sam…",https://english.khabarhub.com/2025/28/503240/,https://english.khabarhub.com/wp-content/uploads/2024/05/News-Nutshell.jpg,,"KATHMANDU: Khabarhub brings you a glimpse of major developments of the day in Nepal, including politics, business/economy, sports, entertainment, and more.
Samyukta Sangharsha Samiti Nepal protests … [+8644 chars]",
b61af43cc964f0ccd08fe369fde4824c,2025-10-28T16:56:02Z,'snow',www.yahoo.com,en,0.0,"New storm to usher in rain, then much colder air with wind in East","It will be a stormy end to October in the eastern United States, and the drenching rain will be followed by a long-lasting burst of chilly air. Some snow may...",https://www.yahoo.com/news/articles/storm-usher-rain-then-much-165602127.html,https://media.zenfs.com/en/accuweather_articles_339/de9d0d84bd288a8904904778bde0d8ee,,"Soon after a nor'easter exits the middle portion of the Atlantic coast Tuesday night, a new storm will swing toward the Appalachians from Wednesday to Thursday, spreading rain through much of the Nor… [+4423 chars]",
d703ed9b1b7d433a61c068df3c7a5864,2025-10-28T18:40:05Z,'snow',www.forbes.com,en,0.0,A Life-Changing Dessert,Snow cones are something else in Panama.,https://www.forbes.com/sites/lizazimmerman/2025/10/28/a-life-changing-dessert/,https://imageio.forbes.com/specials-images/imageserve/68f94107025079945e0936fe/0x0.jpg?format=jpg&height=900&width=1600&fit=bounds,,"Homemade rainbow shaved ice on white background
getty
The first time I tried ice cream I put my face straight into a big swirl of vanilla. My mother has a picture and it is one of my favorite child… [+2064 chars]",
ccd9757f0cc91da9da52101d90bf1886,2025-10-29T07:09:03Z,'slippery roads',yle.fi,en,0.1,"Wednesday's papers: The change in children, winter speed limits, and the doctor is calling","Kids these days don't know how to face conflicts, or resolve them, according to a teacher in Vantaa with over 50 years of professional experience.",https://yle.fi/a/74-20190969,"https://images.cdn.yle.fi/image/upload/c_crop,x_0,y_6,w_5471,h_3077/w_1200,ar_1.91,c_fill/q_auto:eco,f_auto,fl_lossy/v1761719004/39-153503168e630b8a406e",,"Are the kids alright?
It is a question that has come up in many different forms across Finnish media in recent years.
We have heard this past week alone, for example, that many of them can't tell t… [+4887 chars]",
df4af157999399a3eebe939d63d8da70,2025-10-29T18:49:23Z,'slippery roads',post.rlsbb.to,en,0.1,Cities Skylines II Bridges and Ports-RUNE,"Release Description: Link your city to the sea with 20 new bridges, including drawbridges and lift bridges. These are movable structures that allow ships through seaways without the need for towering bridges. Drawbridges carry vehicles and pedestrians, while …",https://post.rlsbb.to/cities-skylines-ii-bridges-and-ports-rune/,,,"Release Description:
 Link your city to the sea with 20 new bridges, including drawbridges and lift bridges. These are movable structures that allow ships through seaways without the need for toweri… [+2431 chars]",
6f3fb2e8af19acf55949c4011b374eb9,2025-10-30T17:38:00Z,'frost weather',www.orlandosentinel.com,en,0.0,"Game time: Fast facts, odds, keys to UCF Knights vs. Baylor","UCF at Baylor Where: McLane Stadium; Waco, Texas When: Saturday, Noon TV: ESPNU Weather: 60 degrees with 35% chance of precipitation Latest line: Baylor by 3.5 points Coaches: Scott Frost is 23-10 at UCF, 39-41 overall; Dave Aranda is 35-34 at Baylor, 35-34 o…",https://www.orlandosentinel.com/2025/10/30/ucf-knights-vs-baylor-tv-info-betting-odds-keys/,https://s.yimg.com/ny/api/res/1.2/NueQZ22ZCGOr6yt6NNOxeA--/YXBwaWQ9aGlnaGxhbmRlcjt3PTEyMDA7aD04NzE7Y2Y9d2VicA--/https://media.zenfs.com/en/orlando_sentinel_local_122/00131622175059d4093a07404064b0a3,,"Where: McLane Stadium; Waco, Texas
When: Saturday, Noon
TV: ESPNU
Weather: 60 degrees with 35% chance of precipitation
Latest line: Baylor by 3.5 points
Coaches:Scott Frost is 23-10 at UCF, 39-4… [+2420 chars]",
8ce4ec4a8e308542f37e033a676b1813,2025-10-31T09:48:45Z,'snow',www.positivityblog.com,en,0.0,90 Funny Winter Quotes That Will Make You Laugh and Help You Relieve Stress,Winter has arrived. With snowy and quiet landscapes and cozy evenings under a blanket with a warm beverage. But also with shorter days that can be both slippery and ice cold. Motivation may be sinking during this time (it often does for me at least). And stre…,https://www.positivityblog.com/funny-winter-quotes/,https://www.positivityblog.com/wp-content/uploads/funny_winter_quotes.jpg,,"Winter has arrived.
With snowy and quiet landscapes and cozy evenings under a blanket with a warm beverage.

But also with shorter days that can be both slippery and ice cold. Motivation may be sink… [+10362 chars]",
e7d3d6fa82a06e27cd5a01395f0503a4,2025-10-31T13:00:40Z,'frost weather',biztoc.com,en,1.0,Thousands Face Plunging Subfreezing Weather: 'Take Steps Now',"Residents across several southern and central U.S. states are being urged to prepare amid subfreezing temperatures and the potential for frost damage.
The National Weather Service (NWS) has issued multiple freeze warnings and frost advisories spanning from Al…",https://biztoc.com/x/71ffeecca3c428e1,https://biztoc.com/cdn/71ffeecca3c428e1_s.webp,,Residents across several southern and central U.S. states are being urged to prepare amid subfreezing temperatures and the potential for frost damage.The National Weather Service (NWS) has issued mul… [+143 chars],
5ee00e5b09119200107381a6241e9c9d,2025-10-31T13:08:43Z,'road salt',www.espn.com,en,0.0,Why to take Cincinnati and the points on the road at Utah,No. 24 Utah is nearly double-digit favorites at home as it welcomes No. 17 Cincinnati to Salt Lake City.,https://www.espn.com/espn/betting/story/_/id/46761257/college-football-betting-2025-how-bet-cincinnati-bearcats-utah-utes,https://a2.espncdn.com/combiner/i?img=%2Fphoto%2F2025%2F1028%2Fr1567508_1296x729_16%2D9.jpg,,"Cincinnati keeps on winning, climbing near the top of the Big 12 race in just its third season in the conference. The Bearcats are undefeated in league play and ranked No. 17 in the country, carrying… [+4463 chars]",
33f7a583f005ba5ccfd58ea18e93ab5e,2025-10-31T15:06:00Z,'winter service',www.cnet.com,en,0.0,Proton VPN Promises Major Improvements For Users In Its Fall and Winter Updates,The popular VPN service says it's adding new free server locations and a fresh VPN architecture.,https://www.cnet.com/tech/services-and-software/proton-vpn-promises-major-improvements-for-users-in-its-fall-and-winter-updates/,https://www.cnet.com/a/img/resize/75e2115633767acdcfbfb9ef9647d4a45be724fa/hub/2025/10/27/c096e81a-64ec-4945-aa19-16c18f14bbe7/why-you-need-a-vpn-for-holiday-travel-nordvpn-on-chromebook-in-suitcase.jpg?auto=webp&fit=crop&height=675&width=1200,,"Days after rolling out its early Black Friday discounts, Proton VPN released its fall and winter product roadmap, announcing the addition of five new free server locations, a new VPN architecture and… [+1207 chars]",
