index,published,keyword,domain,language,valid,title,description,url,image,archive,content,quote,de,en,la,added
128d751130d2f449b39b5a055072dd3f,2026-04-04T18:04:01Z,'snow',timesofindia.indiatimes.com,en,0.9,"‘Not Kashmir!’ Bikaner looks snow-white after rare hailstorm, internet can’t believe it","Bikaner in Rajasthan witnessed an unexpected hailstorm. The desert region turned white, resembling snowfall. This unusual weather followed a western disturbance. The event occurred recently, contrasting with last year's heat. More rain and hailstorms are pred…",https://timesofindia.indiatimes.com/etimes/trending/not-kashmir-bikaner-looks-snow-white-after-rare-hailstorm-internet-cant-believe-it/articleshow/130024752.cms,"https://static.toiimg.com/thumb/msid-130024752,width-1280,height-720,imgsize-59234,resizemode-6,overlay-toi_sw,pt-32,y_pad-600/photo.jpg",,"<ul><li>News</li>
<li>lifestyle</li>
<li>trending</li>
<li>Not Kashmir! Bikaner looks snow-white after rare hailstorm, internet cant believe it</li></ul>
Follow Us On Social Media",,"„Nicht Kaschmir!“ Bikaner sieht nach einem seltenen Hagelsturm schneeweiß aus, das Internet kann es nicht glauben. Bikaner in Rajasthan wurde Zeuge eines unerwarteten Hagelsturms. Die Wüstenregion wurde weiß und ähnelte Schneefall. Dieses ungewöhnliche Wetter folgte einer westlichen Störung. Das Ereignis ereignete sich vor kurzem und stand im Gegensatz zur Hitze des letzten Jahres. Weitere Regen- und Hagelstürme sind vorhersehbar…","‘Not Kashmir!’ Bikaner looks snow-white after rare hailstorm, internet can’t believe it. Bikaner in Rajasthan witnessed an unexpected hailstorm. The desert region turned white, resembling snowfall. This unusual weather followed a western disturbance. The event occurred recently, contrasting with last year's heat. More rain and hailstorms are pred…","'Non Kashmir!' Bikaner post grandinem rare nivem spectat, penitus credere non potest. Bikaner in Rajasthan inopinatam grandinem vidit. Desertum regionem albam, nix similem, volvebat. Insolitam tempestatem occidentalem commotio secuta est. Eventus nuper occurrit, opponens calori proximo anno. Plures pluviae et grandines sunt pred…",2026-04-15 08:16:29+00:00
76eeaaabe1518211a9b980c84de2dc70,2026-04-04T23:15:42Z,'snow',www.bbc.com,en,0.9,How likely is a 'white Easter'?,"While a blanket of snow is more often associated with Christmas than Easter, how do the chances of a White Christmas compare with a White Easter?",https://www.bbc.com/weather/articles/cpd5n97418go,https://ichef.bbci.co.uk/ace/branded_weather/1200/cpsprodpb/1b7c/live/42c7ec40-29d4-11f1-9def-51999882d8d7.jpg,,"Using the 1981-2010 average of number of days where snow falls in a month, March sees 4.2 snow days whilst there are just 3.9 days on average in December.
The majority of Easter Days occur in April,… [+695 chars]",,"Wie wahrscheinlich ist ein „weißes Ostern“? Während eine Schneedecke häufiger mit Weihnachten als mit Ostern in Verbindung gebracht wird, wie stehen die Chancen auf weiße Weihnachten im Vergleich zu weißen Ostern?","How likely is a 'white Easter'?. While a blanket of snow is more often associated with Christmas than Easter, how do the chances of a White Christmas compare with a White Easter?","Quam probabile est ""album pascha""? Cum stragulum nivis frequentius cum Nativitate quam Pascha coniungitur, quomodo casus Nativitatis Candidae cum Alba Paschae comparantur?",2026-04-15 08:16:29+00:00
e0b2cdc1fb775fc9058ba34f44ba4cf9,2026-04-05T01:30:01Z,'snow',english.khabarhub.com,en,0.9,"Gusty winds, rain to hit hills and Terai regions","KATHMANDU: The Department of Hydrology and Meteorology has forecast rain in several parts of the country today under the influence of a western low-pressure system and local winds. The weather is currently generally cloudy nationwide, with light rain and snow…",https://english.khabarhub.com/2026/05/542629/,https://english.khabarhub.com/wp-content/uploads/2021/10/Weather-1-e1750897810127.jpg,,"KATHMANDU: The Department of Hydrology and Meteorology has forecast rain in several parts of the country today under the influence of a western low-pressure system and local winds.
The weather is cu… [+1272 chars]",,"Böige Winde, Regen, der auf Hügel und Terai-Regionen trifft. KATHMANDU: Das Ministerium für Hydrologie und Meteorologie hat heute Regen in mehreren Teilen des Landes unter dem Einfluss eines westlichen Tiefdrucksystems und lokaler Winde vorhergesagt. Das Wetter ist derzeit landesweit überwiegend bewölkt, mit leichtem Regen und Schnee…","Gusty winds, rain to hit hills and Terai regions. KATHMANDU: The Department of Hydrology and Meteorology has forecast rain in several parts of the country today under the influence of a western low-pressure system and local winds. The weather is currently generally cloudy nationwide, with light rain and snow…","Venti procellosi, pluvias collis et Terai regiones ferire. KATHMANDU: Department of Hydrologiae et Meteorologiae pluviam praenuntiaverunt in pluribus terrae partibus hodie sub influxu systematis occidentis humilis pressionis et ventorum localium. Tempestas est currently plerumque nationum nubilum, cum pluviis et nivis...",2026-04-15 08:16:29+00:00
71008511d6f9a1bce0995c0978d3351b,2026-04-05T06:30:15Z,'snow',ahouseinthehills.com,en,0.9,Standard Roof Pitch That Actually Fits Your Home,"Most people choose a roof design based solely on looks; that’s where things go wrong. The standard roof pitch affects far more than appearance; it determines how well a roof sheds rain, handles snow, and withstands the weather over the years. Getting it wrong…",https://ahouseinthehills.com/standard-roof-pitch/,https://ahouseinthehills.com/wp-content/uploads/2026/03/standard-roof-pitch-on-a-residential-house-with-asphalt-shingles-in-a-suburban-neighborhood.png,,"Most people choose a roof design based solely on looks; that’s where things go wrong.
The standard roof pitch affects far more than appearance; it determines how well a roof sheds rain, handles snow… [+7585 chars]",,"Standard-Dachneigung, die tatsächlich zu Ihrem Zuhause passt. Die meisten Menschen entscheiden sich ausschließlich aufgrund des Aussehens für eine Dachkonstruktion. da geht es schief. Die Standarddachneigung beeinflusst weit mehr als nur das Aussehen; Es bestimmt, wie gut ein Dach Regen abhält, Schnee verträgt und dem Wetter im Laufe der Jahre standhält. Es liegt falsch...","Standard Roof Pitch That Actually Fits Your Home. Most people choose a roof design based solely on looks; that’s where things go wrong. The standard roof pitch affects far more than appearance; it determines how well a roof sheds rain, handles snow, and withstands the weather over the years. Getting it wrong…","Standard Roof Pix Quod vere aptat domum tuam. Tectum consilium plerique ex solo vultu eligunt; ubi res erratur. Vexillum tectum pice multo magis quam aspectu afficit; decernit quam bene tectum pluat, nives tractat, tempestates per annos sustinet. Questus est iniuriam…",2026-04-15 08:16:29+00:00
2e534339dfb66fc00c83c00f0797b36c,2026-04-05T06:45:02Z,'snowfall',english.khabarhub.com,en,0.9,Snowfall hits Upper Mustang and Muktinath,"MUSTANG: Heavy snowfall has been reported in Upper Mustang and Muktinath regions since Saturday night, continuing the winter season’s impact in the area. The first snowfall of the season occurred on October 27, making this the sixth snowfall of the ongoing se…",https://english.khabarhub.com/2026/05/542689/,https://english.khabarhub.com/wp-content/uploads/2026/04/Snowfall-Mustang-e1775369696906.jpeg,,"MUSTANG: Heavy snowfall has been reported in Upper Mustang and Muktinath regions since Saturday night, continuing the winter seasons impact in the area.
The first snowfall of the season occurred on … [+1963 chars]",,"Schneefall trifft Upper Mustang und Muktinath. MUSTANG: In den Regionen Upper Mustang und Muktinath wurden seit Samstagnacht starke Schneefälle gemeldet, was die Auswirkungen der Wintersaison in der Region fortsetzt. Der erste Schneefall der Saison fiel am 27. Oktober und ist damit der sechste Schneefall der laufenden Saison.","Snowfall hits Upper Mustang and Muktinath. MUSTANG: Heavy snowfall has been reported in Upper Mustang and Muktinath regions since Saturday night, continuing the winter season’s impact in the area. The first snowfall of the season occurred on October 27, making this the sixth snowfall of the ongoing se…","Snowfall superioris Mustang et Muktinath pervenit. MUSTANG: Gravis nix in regiones superiore Mustang et Muktinath relata est post noctem Sabbati, hiberno tempore impulsum in area continuando. Prima nix temporis obvenit die 27 mensis Octobris, qua haec sexta nix continuae se…",2026-04-15 08:16:29+00:00
a7fcc3cd218d367790b83f6762629955,2026-04-05T23:44:10Z,'snow ice',www.cbc.ca,en,0.9,More than 160 crashes reported by Calgary police Sunday amid snowfall,Yet another round of snowfall hit Calgary Sunday. Dangerous driving conditions led to a significant number of accidents.,https://www.cbc.ca/news/canada/calgary/calgary-snow-police-collisions-9.7153843,"https://i.cbc.ca/ais/1.7386229,1732334075000/full/max/0/default.jpg?im=Crop%2Crect%3D%28145%2C0%2C1640%2C922%29%3BResize%3D620",,"Yet another round of snowfall hit Calgary Sunday, creating hazardous driving conditions which led to a significant number of accidents.
Calgary police say there were 163 collisions across the city r… [+791 chars]",,Die Polizei von Calgary meldete am Sonntag mehr als 160 Unfälle bei Schneefall. Eine weitere Runde Schneefall traf Calgary am Sonntag. Gefährliche Fahrbedingungen führten zu einer erheblichen Anzahl von Unfällen.,More than 160 crashes reported by Calgary police Sunday amid snowfall. Yet another round of snowfall hit Calgary Sunday. Dangerous driving conditions led to a significant number of accidents.,Plus quam 160 fragores nuntiaverunt vigilum Solis Calgary inter nix. Sed aliud nix circum Calgary Solis ledo. Periculo pulsis conditionibus ad notabilem numerum accidentium ducitur.,2026-04-15 08:16:29+00:00
91c1a7ca12b97b202c37b3e3bc8b9729,2026-04-06T12:04:28Z,'snowfall',english.khabarhub.com,en,0.9,"Heavy snowfall blankets Mustang, disrupts Muktinath pilgrimage","MUSTANG: Heavy snowfall has been reported in lower Mustang, including the Muktinath area of Waragung Muktikshetra–1. Snow has been falling continuously since this afternoon in the Muktinath region. According to Dinesh Bhusal, Manager of the Muktinath Developm…",https://english.khabarhub.com/2026/06/542926/,https://english.khabarhub.com/wp-content/uploads/2026/04/Snowfall-Muktinaht.jpeg,,"MUSTANG: Heavy snowfall has been reported in lower Mustang, including the Muktinath area of Waragung Muktikshetra1. Snow has been falling continuously since this afternoon in the Muktinath region.
A… [+498 chars]",,"Starker Schneefall bedeckt Mustang und stört Muktinath-Pilgerfahrt. MUSTANG: Im unteren Teil von Mustang, einschließlich des Muktinath-Gebiets von Waragung Muktikshetra–1, wurde starker Schneefall gemeldet. Seit heute Nachmittag fällt in der Region Muktinath ununterbrochen Schnee. Laut Dinesh Bhusal, Manager des Muktinath Developmentm…","Heavy snowfall blankets Mustang, disrupts Muktinath pilgrimage. MUSTANG: Heavy snowfall has been reported in lower Mustang, including the Muktinath area of Waragung Muktikshetra–1. Snow has been falling continuously since this afternoon in the Muktinath region. According to Dinesh Bhusal, Manager of the Muktinath Developm…","Gravis stragula nix Mustang, peregrinationem rumpit Muktinath. MUSTANG: Gravis nix in inferiore Mustang relata est, incluso Muktinath area Waragung Muktikshetra-1. Nix continue cecidit ex hoc post meridiem in regione Muktinath. Secundum Dinesh Bhusal, Procurator Muktinath Developm…",2026-04-15 08:16:29+00:00
77466d71b31e76ef900b39a9aea306c9,2026-04-06T16:00:00Z,'snow',cheezburger.com,en,0.9,Homeowner awoken at 6 am to their entitled neighbor demanding that they shovel their shared portion of the driveway despite the driveway being mostly cleared and not even their responsibility: 'He was furious because it had snowed overnight',"A homeowner got a rough early-morning awakening when a neighbor escalated a minor snow-clearing delay into an early-morning confrontation and threatened over a shared road that isn't legally the homeowner's responsibility
Shakespeare loved to include how nat…",https://cheezburger.com/44907781/homeowner-awoken-at-6-am-to-their-entitled-neighbor-demanding-that-they-shovel-their-shared-portion,https://i.chzbgr.com/original/44907781/h8A03ACD4/bad-neighbors-neighborhood-stories-terrible-neighbors-bad-neighbor-neighbor-neighbors-44907781,,"Still, there's a way to act and a way not to, especially when it comes to our relationships with our neighbors and our interactions in society. 
This homeowner was startlingly awoken to their angry … [+791 chars]",,"Der Hausbesitzer wachte um 6 Uhr morgens auf, als sein berechtigter Nachbar ihn aufforderte, seinen gemeinsamen Teil der Auffahrt zu schaufeln, obwohl die Auffahrt größtenteils geräumt war und nicht einmal in seine Verantwortung fiel: „Er war wütend, weil es über Nacht geschneit hatte.“ Ein Hausbesitzer erwachte am frühen Morgen heftig, als ein Nachbar eine geringfügige Verzögerung bei der Schneeräumung zu einer frühmorgendlichen Auseinandersetzung ausweitete und wegen einer gemeinsamen Straße drohte, die rechtlich nicht in die Verantwortung des Hausbesitzers fällt
Shakespeare liebte es, zu erwähnen, wie natürlich …","Homeowner awoken at 6 am to their entitled neighbor demanding that they shovel their shared portion of the driveway despite the driveway being mostly cleared and not even their responsibility: 'He was furious because it had snowed overnight'. A homeowner got a rough early-morning awakening when a neighbor escalated a minor snow-clearing delay into an early-morning confrontation and threatened over a shared road that isn't legally the homeowner's responsibility
Shakespeare loved to include how nat…","Homeowner evigilavit ad VI sum ad proximos qui intitulati sunt flagitantes ut communem partem gestationis trudant quamvis plerumque purgatae gestationis et ne eorum quidem responsabilitas: 'incensus erat quod pernoctare ninxit'. Paterfamilias rudis mane-mane expergefactus obtinuit cum vicinus moram nivalem purgandi moram in primo mane opponendi evasit et minatus est viam communem quae non iure est responsabilitatis homeowner
Shakespeare amavit includere quomodo nat…",2026-04-15 08:16:29+00:00
e164802f3f1ee5173861630df4a65baf,2026-04-06T20:33:05Z,'snowfall',matadornetwork.com,en,0.9,Chasing Big-Mountain Dreams and Snowboarding’s Future in Alaska,"A snowboarder dreamt about big lines in Alaska, but when he made it happen, it was witnessing the sport's future that inspired him the most.",https://matadornetwork.com/read/alaska-snowboard-dream-trip/,https://cdn1.matadornetwork.com/blogs/1/2026/04/Alaska-snowboard-Tim-social-1.jpg,,"In March 2026, nearly 30 years later, I finally got my chance to follow that vision north. The question wasn’t only whether Alaska would live up to the version I’d built in my head. It was how close … [+10301 chars]",,"Auf der Jagd nach Big-Mountain-Träumen und der Zukunft des Snowboardens in Alaska. Ein Snowboarder träumte von großen Lines in Alaska, aber als er es wahr machte, war es die Zukunft des Sports, die ihn am meisten inspirierte.","Chasing Big-Mountain Dreams and Snowboarding’s Future in Alaska. A snowboarder dreamt about big lines in Alaska, but when he made it happen, it was witnessing the sport's future that inspired him the most.","Somnium Big-montis venationis et Future Snowboarding in Alaska. A snowboarder in Alaska de magnis lineis somniavit, sed cum hoc factum esset, ludibrium futurum spectabat quod eum maxime inspiravit.",2026-04-15 08:16:29+00:00
de3b1b68866053c5e6ade5220350c3dc,2026-04-10T20:00:00Z,'snow',consent.yahoo.com,en,0.7,"Winter Storm Warning: Up to 28 Inches of Snow and 80 MPH Gusts Threaten I-80, Highway 50 and Highway 395 Across the Sierra Nevada This Weekend",,https://consent.yahoo.com/v2/collectConsent?sessionId=1_cc-session_9fc2b54d-7bb1-467a-a3ba-b67ebe7c704e,,,"If you click 'Accept all', we and our partners, including 251 who are part of the IAB Transparency &amp; Consent Framework, will also store and / or access information on a device (in other words, us… [+1046 chars]",,"Wintersturmwarnung: Bis zu 28 Zoll Schnee und Böen von 80 Meilen pro Stunde bedrohen an diesem Wochenende die I-80, den Highway 50 und den Highway 395 in der Sierra Nevada. Keiner","Winter Storm Warning: Up to 28 Inches of Snow and 80 MPH Gusts Threaten I-80, Highway 50 and Highway 395 Across the Sierra Nevada This Weekend. None","Tempestas hiemalis Admonitio: Usque ad 28 uncias nivis et 80 MPH Impetus minantes I-80, Via 50 et Via 395 Trans Sierra Nevada Hoc Volutpat. Nullus",2026-04-15 14:14:01+00:00
866aba8b907e2cc989b486ca923d2855,2026-04-12T01:30:58Z,'snow',www.autoblog.com,en,0.7,"Winter Storm Warning Upgraded: Up to 60 Inches of Snow & 90 MPH Gusts Threaten I-80, Highway 50 & Highway 395 Across the Sierra Nevada",The Sierra Nevada storm originally reported by Autoblog on Friday has escalated significantly. What started as a Winter Storm Warning for Mono County and the...,https://www.autoblog.com/news/winter-storm-warning-upgraded-up-to-60-inches-of-snow-90-mph-gusts-threaten-i-80-highway-50-highway-395-across-the-sierra-nevada,https://s.yimg.com/os/en/autoblog_arena_articles_145/d3ef1e8d449ce3142330775e2180f3b3,,"Autoblog and Yahoo may earn commission from links in this article.
The Sierra Nevada storm originally reported by Autoblog on Friday has escalated significantly. What started as a Winter Storm Warni… [+6825 chars]",,"Wintersturmwarnung verbessert: Bis zu 60 Zoll Schnee und Böen von 90 Meilen pro Stunde bedrohen die I-80, den Highway 50 und den Highway 395 in der Sierra Nevada. Der Sturm in der Sierra Nevada, über den Autoblog ursprünglich am Freitag berichtete, hat deutlich zugenommen. Was als Wintersturmwarnung für Mono County und die ... begann","Winter Storm Warning Upgraded: Up to 60 Inches of Snow & 90 MPH Gusts Threaten I-80, Highway 50 & Highway 395 Across the Sierra Nevada. The Sierra Nevada storm originally reported by Autoblog on Friday has escalated significantly. What started as a Winter Storm Warning for Mono County and the...","Tempestas hiemalis Admonitio Upgraded: Usque ad 60 Uncias Nivis & 90 MPH Impetus Threaten I-80, Via 50 & Via 395 Trans Nevada Sierra. Tempestas Sierra Nevada primitus nuntiata ab Autoblog die Veneris signanter evasit. Quid incepit hiemalis Admonitio pro Comitatu Mono ac ...",2026-04-15 14:14:01+00:00
320ab9c02384a3d5e9b6afef17c21d47,2026-04-12T16:50:30Z,'snow',consent.yahoo.com,en,0.7,Winter Storm Warnings for 28 Inches of Snow and 100 MPH Winds Strike: 'Stay Home and Stay Safe',,https://consent.yahoo.com/v2/collectConsent?sessionId=1_cc-session_70db4930-d62e-491c-aaa4-0ce30850ea09,,,"If you click 'Accept all', we and our partners, including 251 who are part of the IAB Transparency &amp; Consent Framework, will also store and / or access information on a device (in other words, us… [+1046 chars]",,Wintersturmwarnungen für 28 Zoll Schnee und Windgeschwindigkeiten von 100 Meilen pro Stunde: „Bleiben Sie zu Hause und bleiben Sie sicher.“ Keiner,Winter Storm Warnings for 28 Inches of Snow and 100 MPH Winds Strike: 'Stay Home and Stay Safe'. None,Tempestas Hiemalis Admonitiones pro 28 Unciarum Nivis et 100 Ventorum MPH Percute: 'Mane Domus et Tutus'. Nullus,2026-04-15 14:14:01+00:00
4278e64ae9386b9d501c20cb162d8e1a,2026-04-04T16:54:25Z,'snow',consent.yahoo.com,en,0.9,Crash reports as heavy snow hits Minnesota; stranded drivers force I-94 closure in ND,,https://consent.yahoo.com/v2/collectConsent?sessionId=1_cc-session_71aa78c5-d76e-4db6-bf76-db48ca837030,,,"If you click 'Accept all', we and our partners, including 251 who are part of the IAB Transparency &amp; Consent Framework, will also store and / or access information on a device (in other words, us… [+1046 chars]",,Absturzmeldungen bei starkem Schneefall in Minnesota; Gestrandete Fahrer erzwingen die Sperrung der I-94 in ND. Keiner,Crash reports as heavy snow hits Minnesota; stranded drivers force I-94 closure in ND. None,Fragor refert quam gravem nivem Minnesota hits; destitutus coegi vi 94 clausurae i-in ND. Nullus,2026-04-15 14:14:01+00:00
b1f67ecf42a1133f576e01e1d5746faf,2026-04-02T00:28:15Z,'slippery roads',www.cbsnews.com,en,0.9,"Some Minnesota schools announce closings, virtual learning on Thursday due to snow",Some schools in Minnesota have already announced closings or shifts to virtual learning on Thursday as another round of winter weather threatens parts of the state.,https://www.cbsnews.com/minnesota/news/school-closings-delays-minnesota-april-2-2026/,https://assets2.cbsnewsstatic.com/hub/i/r/2026/01/23/28ded277-4bea-4bc1-9666-9f72dcfbff55/thumbnail/1200x630/ac14d5311df5543cb2b0dfb6e235a2d8/gettyimages-717174227.jpg,,"Some schools in Minnesota have already announced closings or shifts to virtual learning on Thursday as another round of winter weather threatens parts of the state.
The full list of closings is belo… [+756 chars]",,"Einige Schulen in Minnesota kündigen Schließungen und virtuellen Unterricht am Donnerstag wegen Schnee an. Einige Schulen in Minnesota haben bereits am Donnerstag Schließungen oder die Umstellung auf virtuellen Unterricht angekündigt, da eine weitere Runde Winterwetter Teile des Staates bedroht.","Some Minnesota schools announce closings, virtual learning on Thursday due to snow. Some schools in Minnesota have already announced closings or shifts to virtual learning on Thursday as another round of winter weather threatens parts of the state.","Nonnullae scholae Minnesota clausuras nuntiant, doctrina virtuali Iovis ob nivem debitam. Nonnullae scholae Minnesotae iam nuntiaverunt clausuras vel adiuncta ad rectum discendum die Iovis sicut altera tempestas hiemalis partibus rei publicae imminet.",2026-04-15 19:54:53+00:00
c4b2fa817010f9fd409eb6d565ce0cc0,2026-04-02T19:30:56Z,'snow ice',www.cbc.ca,en,0.9,Two dozen people injured in crashes during April snowstorm: police,"Another blast of snow hit Calgary just in time for the morning commute Thursday, making for slippery roads and more than 160 crashes.",https://www.cbc.ca/news/canada/calgary/calgary-april-2-snowstorm-9.7151970,"https://i.cbc.ca/ais/a1820d7c-42eb-41a3-abee-089c6fb24c46,1775156037094/full/max/0/default.jpg?im=Crop%2Crect%3D%280%2C378%2C4032%2C2268%29%3BResize%3D620",http://web.archive.org/web/20260403002137/https://www.cbc.ca/news/canada/calgary/calgary-april-2-snowstorm-9.7151970,"Calgarians might have been hoping the beginning of April would bring more spring-like weather, but it seems Mother Nature had other plans in mind. 
Another blast of snow hit the city just in time fo… [+1163 chars]",,Zwei Dutzend Menschen bei Unfällen im Schneesturm im April verletzt: Polizei. Pünktlich zum morgendlichen Pendelverkehr am Donnerstag traf ein weiterer Schneestoß Calgary und sorgte für rutschige Straßen und mehr als 160 Unfälle.,"Two dozen people injured in crashes during April snowstorm: police. Another blast of snow hit Calgary just in time for the morning commute Thursday, making for slippery roads and more than 160 crashes.","Duo duodecim homines in ruinis per Aprilem snowstorm: vigilum. Alius flatus nivis Calgary iustus in tempore Iovis mane commutandi, viae lubricae et plusquam 160 fragores facit.",2026-04-15 19:54:53+00:00
f44c58b356ef11b508cdb3db5418bc91,2026-04-03T14:57:30Z,'snow',www.cbc.ca,en,0.9,Icy start to Easter weekend with freezing rain expected across much of Maritimes,"Freezing rain is expected to make travel difficult across most of the Maritimes at the beginning of the Easter long weekend, with some regions also under snowfall warnings.",https://www.cbc.ca/news/canada/prince-edward-island/pei-freezing-rain-easter-weekend-9.7152862,"https://i.cbc.ca/ais/1.4621646,1732569913000/full/max/0/default.jpg?im=Crop%2Crect%3D%280%2C310%2C6000%2C3375%29%3BResize%3D620",,"Freezing rain is expected to make travel difficult across much of the Maritimes at the beginning of the Easter long weekend, with some areas also facing significant snowfall.
Environment Canada has … [+1681 chars]",,"Eisiger Beginn des Osterwochenendes, in weiten Teilen der maritimen Region wird mit Eisregen gerechnet. Es wird erwartet, dass zu Beginn des langen Osterwochenendes eisiger Regen das Reisen in den meisten Küstengebieten erschwert, wobei für einige Regionen auch Schneefallwarnungen gelten.","Icy start to Easter weekend with freezing rain expected across much of Maritimes. Freezing rain is expected to make travel difficult across most of the Maritimes at the beginning of the Easter long weekend, with some regions also under snowfall warnings.","Glacialis initium ad Paschae volutpat cum frigore pluviae per multum maritimorum expectata est. Imber rigens expectatur iter difficilem facere trans plurimorum maritimorum ineunte tempore paschali volutpat, cum nonnullis etiam regionibus sub nix monitis.",2026-04-15 19:54:53+00:00
