index,published,keyword,domain,language,valid,title,description,url,image,archive,content,quote,de,en,la,added
239ad0fba9740ea075f65b5e5850254b,2026-07-01T05:37:28Z,'snow',post.rlsbb.to,en,0.7,Difficult People S02 BDRip x264-SNOW,"Julie and Billy, two jaded aspiring comedians who live together in New York City, navigate through their thirties while dealing with their individual careers and personal relationships. Links: HOMEPAGE – iMDBDifficult.People.S02.BDRip.x264-SNOWMKV | AAC | 10E…",https://post.rlsbb.to/difficult-people-s02-bdrip-x264-snow/,,,"Julie and Billy, two jaded aspiring comedians who live together in New York City, navigate through their thirties while dealing with their individual careers and personal relationships. 
Links:HOMEP… [+142 chars]",,"Schwierige Menschen S02 BDRip x264-SNOW. Julie und Billy, zwei abgestumpfte aufstrebende Komiker, die zusammen in New York City leben, navigieren durch ihre Dreißiger und beschäftigen sich gleichzeitig mit ihrer individuellen Karriere und ihren persönlichen Beziehungen. Links: HOMEPAGE – iMDBDifficult.People.S02.BDRip.x264-SNOWMKV | AAC | 10E…","Difficult People S02 BDRip x264-SNOW. Julie and Billy, two jaded aspiring comedians who live together in New York City, navigate through their thirties while dealing with their individual careers and personal relationships. Links: HOMEPAGE – iMDBDifficult.People.S02.BDRip.x264-SNOWMKV | AAC | 10E…","Homines difficilis S02 BDRip x264-NIX. Julie et Billy, duo comici adfectati, qui simul in urbe New York vivunt, per triginta navigant, dum de singulis curriculis et relationes personales agunt. Links: HOMEPAGE – iMDBDifficult.People.S02.BDRip.x264-SNOWMKV | AAC | 10E…",2026-07-03 05:35:01+00:00
a1fd09e7922ce16cd33099640f1c57a9,2026-07-01T08:44:04Z,'snow',www.rte.ie,en,0.7,Snow Patrol's Lightbody duets with Minogue on new single,Snow Patrol and Kylie Minogue have officially announced a new collaboration with upcoming single These Alarms.,https://www.rte.ie/entertainment/2026/0701/1581211-snow-patrols-lightbody-duets-with-minogue-on-new-single/,https://www.rte.ie/images/00249e08-1600.jpg,http://web.archive.org/web/20260702034348/https://www.rte.ie/entertainment/2026/0701/1581211-snow-patrols-lightbody-duets-with-minogue-on-new-single/,"Snow Patrol and Kylie Minogue have officially announced a new collaboration with upcoming single These Alarms.
The band originally recorded the track for their 2024 album The Forest is the Path unde… [+1637 chars]",,Snow Patrols Lightbody-Duett mit Minogue auf neuer Single. Snow Patrol und Kylie Minogue haben offiziell eine neue Zusammenarbeit mit der kommenden Single These Alarms angekündigt.,Snow Patrol's Lightbody duets with Minogue on new single. Snow Patrol and Kylie Minogue have officially announced a new collaboration with upcoming single These Alarms.,Nives Patrol's Lightbody duets with Minogue on new single. Nives Patrol et Kylie Minogue publice nuntiaverunt novam cooperationem cum uno venturo haec Alarms.,2026-07-03 05:35:01+00:00
62af9a2475876f0f45df12ce6cb92ffb,2026-07-01T21:00:00Z,'snow',comicbook.com,en,0.7,"Daenerys Targaryen’s Return Is Defining House of the Dragon’s New Era, 7 Years After Her GOT Death","Image via HBO

It has been seven years since Jon Snow put a knife in Daenerys Targaryen and ended her life. Seven years since Game of Thrones‘ ending turned Dany into its final villain, sparking a huge backlash in the process. And yet, after all that time, th…",http://comicbook.com/tv-shows/feature/daenerys-targaryens-return-is-defining-house-of-the-dragons-new-era-7-years-after-her-got-death/,"https://comicbook.com/wp-content/uploads/sites/4/2026/07/Daenerys-Targaryen-Emilia-Clarke-in-Game-of-Thrones.jpg?resize=2000,1125",http://web.archive.org/web/20260702020407/https://comicbook.com/tv-shows/feature/daenerys-targaryens-return-is-defining-house-of-the-dragons-new-era-7-years-after-her-got-death/,"It has been seven years since Jon Snow put a knife in Daenerys Targaryen and ended her life. Seven years since Game of Thrones‘ ending turned Dany into its final villain, sparking a huge backlash in … [+3032 chars]",,"Daenerys Targaryens Rückkehr prägt die neue Ära von House of the Dragon, sieben Jahre nach ihrem Tod. Bild über HBO

Es ist sieben Jahre her, seit Jon Snow Daenerys Targaryen mit einem Messer verletzt und ihr das Leben gekostet hat. Sieben Jahre nach dem Ende von „Game of Thrones“ wurde Dany zum letzten Bösewicht und löste dabei eine große Gegenreaktion aus. Und doch, nach all der Zeit, …","Daenerys Targaryen’s Return Is Defining House of the Dragon’s New Era, 7 Years After Her GOT Death. Image via HBO

It has been seven years since Jon Snow put a knife in Daenerys Targaryen and ended her life. Seven years since Game of Thrones‘ ending turned Dany into its final villain, sparking a huge backlash in the process. And yet, after all that time, th…","Daenery Targaryen reditio est Definiens Domus in Novo Draco, 7 Annos Post Mortem Her. Imago per HBO

Septem annos fuit ex quo Jon Snow gladium in Daenery Targaryen posuit et vitam suam finivit. Septem annos post Ludus Thronorum' ending Dany in ultimum suum pessimum vertitur, ingens backlash in processu coruscans. Attamen, toto illo tempore.",2026-07-03 20:02:31+00:00
a2d19ecf4cc455639f0bb2ae03488386,2026-07-01T16:36:15Z,'snow',www.popsci.com,en,0.9,It snowed in Yellowstone this week,"The higher the elevation, the cooler the temperature.
The post It snowed in Yellowstone this week appeared first on Popular Science.",http://www.popsci.com/environment/yellowstone-summer-snow/,https://www.popsci.com/wp-content/uploads/2026/07/Yellowstone-Summer-Snow.jpeg?w=1200,http://web.archive.org/web/20260702032435/https://www.popsci.com/environment/yellowstone-summer-snow/,"Get the Popular Science daily newsletter
Breakthroughs, discoveries, and DIY tips sent six days a week.
By signing up, you confirm you are 16+, will receive newsletters and promotional content and … [+1850 chars]",,"Diese Woche hat es im Yellowstone geschneit. Je höher die Höhe, desto kühler die Temperatur.
Der Beitrag Diese Woche hat es im Yellowstone geschneit erschien zuerst auf Popular Science.","It snowed in Yellowstone this week. The higher the elevation, the cooler the temperature.
The post It snowed in Yellowstone this week appeared first on Popular Science.","Hoc septimana in Yellowstone ninxit. Altior sublimitas, frigidior est temperies.
Post nix in Yellowstone hac septimana primum apparuit in Scientia Populari.",2026-07-03 20:02:31+00:00
7ad757de2ad56a5ff883ee8bb7609ab0,2026-07-01T19:00:38Z,'snow',www.fly4free.com,en,0.9, Cheap Air France/KLM fights from Baltic and Nordic countries to Peru from €688 ,"Peru is a country where ancient Inca cities emerge from the clouds, alpacas roam beneath snow-capped mountains, colourful markets fill colonial streets, and landscapes change dramatically from the Andes to the Amazon rainforest and the Pacific coast. With the…",https://www.fly4free.com/flight-deals/europe/flights-from-the-baltics-to-peru-e688/,https://assets.fly4free.com/wp-content/uploads/2026/07/willian-justen-de-vasconcellos-ulUnRNuC_ok-unsplash-2-800x533.jpg,,"Peru is a country where ancient Inca cities emerge from the clouds, alpacas roam beneath snow-capped mountains, colourful markets fill colonial streets, and landscapes change dramatically from the An… [+5708 chars]",,"Günstige Air France/KLM-Flüge von den baltischen und nordischen Ländern nach Peru ab 688 €. Peru ist ein Land, in dem alte Inkastädte aus den Wolken auftauchen, Alpakas unter schneebedeckten Bergen umherstreifen, farbenfrohe Märkte Kolonialstraßen füllen und sich die Landschaften von den Anden über den Amazonas-Regenwald bis zur Pazifikküste dramatisch verändern. Mit dem…"," Cheap Air France/KLM fights from Baltic and Nordic countries to Peru from €688 . Peru is a country where ancient Inca cities emerge from the clouds, alpacas roam beneath snow-capped mountains, colourful markets fill colonial streets, and landscapes change dramatically from the Andes to the Amazon rainforest and the Pacific coast. With the…","Cheap Air France/KLM de regionibus Balticis et Nordic usque ad Peruviam de €688 pugnat. Peruvia est patria ubi antiquae Incapae urbes e nubibus emergunt, alpacas sub montibus niveis vagantur, mercatus varios vias colonias implent, et landscapes ab Andibus ad Amazonum saltus et littus Pacifici obturbationem mutant. Cum…",2026-07-03 20:02:31+00:00
5aea6e40cf451e5420d38055c8c3102a,2026-07-03T19:20:00Z,'snow',www.animenewsnetwork.com,en,0.7,"Ize Press Licenses Legroom, Philomel the Fake, Footsteps in the Snow for January 2027 Print Release","Full-color paperback editions will be available at bookstores, comic shops, online retailers beginning in January 2027",https://www.animenewsnetwork.com/news/2026-07-03/ize-press-licenses-legroom-philomel-the-fake-footsteps-in-the-snow-for-january-2027-print-release/.239212,https://www.animenewsnetwork.com/thumbnails/crop600x315gG3/cms/news.9/239212/philomel-the-fake-cnf.jpg,,"Ize Press announced at its Anime Expo industry panel on Friday that it has licensed three more Korean webtoons for English print publication: Legroom, Philomel the Fake, and Footsteps in the Snow. Al… [+1889 chars]",,"Ize Press lizenziert Legroom, Philomel the Fake, Footsteps in the Snow für die Druckveröffentlichung im Januar 2027. Vollfarbige Taschenbuchausgaben werden ab Januar 2027 in Buchhandlungen, Comic-Läden und Online-Händlern erhältlich sein","Ize Press Licenses Legroom, Philomel the Fake, Footsteps in the Snow for January 2027 Print Release. Full-color paperback editions will be available at bookstores, comic shops, online retailers beginning in January 2027","Ize Press licentias Legroom, Philomela Fake, Footsteps in nive pro January 2027 Print Release. Full-color paperback editiones praesto erunt apud bibliopolios, tabernas comicas, venditores online mense Ianuario 2027 incipientes",2026-07-05 09:31:12+00:00
82b60adb1a505cce7e06e787d7c6dfa6,2026-07-04T04:15:00Z,'snow',www.irishtimes.com,en,0.7,Indie Kylie Minogue is back thanks to Snow Patrol. Can we keep her for a little while?,"‘No one willingly wants to be indie,’ Nick Cave says. The good news for Impossible Princess loyalists is that Minogue just might",https://www.irishtimes.com/culture/2026/07/04/indie-kylie-minogue-is-back-thanks-to-snow-patrol-can-we-keep-her-for-a-little-while/,https://www.irishtimes.com/resizer/v2/4BQOUSVZFJBEBN2E4DDH3R5I2A.jpg?smart=true&auth=f453169718fae025de680dfb226ccc9408164cf075f5d8d1ceec5db13d09bd6d&width=1200&height=630,http://web.archive.org/web/20260704053604/https://www.irishtimes.com/culture/2026/07/04/indie-kylie-minogue-is-back-thanks-to-snow-patrol-can-we-keep-her-for-a-little-while/,"Has Kylie Minogue resurrected her short-lived Indie Kylie incarnation for another spin? The evidence is strong. This week brought the release of These Alarms, her collaboration with Snow Patrol. Defi… [+4903 chars]",,"Die Indie-Künstlerin Kylie Minogue ist dank Snow Patrol zurück. Können wir sie für eine Weile behalten? „Niemand möchte freiwillig Indie sein“, sagt Nick Cave. Die gute Nachricht für Anhänger von „Impossible Princess“ ist, dass Minogue es durchaus schaffen könnte","Indie Kylie Minogue is back thanks to Snow Patrol. Can we keep her for a little while?. ‘No one willingly wants to be indie,’ Nick Cave says. The good news for Impossible Princess loyalists is that Minogue just might","Indie Kylie Minogue est reversus gratias Nivis Patrol. Possumusne eam paulisper tenere? 'Nemo libenter vult esse indie', 'Nick Cave' dicit. Bonum nuntium pro Impossibile Principem optimatum est Minogue iustus potens",2026-07-05 09:31:12+00:00
e50f98f92b7c84dd31198af59e762d9d,2026-07-03T14:31:30Z,'snow ice',slickdeals.net,en,0.7,$39.99: Nostalgia Retro Snow Cone Maker Countertop 5-qt Shaved Ice Machine Stainless Steel Blades Pink,"Amazon.com [amazon.com] has *Nostalgia Retro Snow Cone Maker – Countertop 5-qt Shaved Ice Machine – Stainless Steel Blades – Includes 2 Reusable Cups, Ice Scoop, & Sid Shelf – Pink* on sale for...",https://slickdeals.net/f/19717626-39-99-nostalgia-retro-snow-cone-maker-countertop-5-qt-shaved-ice-machine-stainless-steel-blades-pink,https://slickdeals.net/attachment/8/6/7/1/9/450x450/20891520.thumb,,"This collaborative space allows users to contribute additional information, tips, and insights to enhance the original deal post. Feel free to share your knowledge and help fellow shoppers make infor… [+26 chars]",,"39,99 $: Nostalgia Retro Snow Cone Maker Arbeitsplatte 5-qt Rasiereismaschine Edelstahlklingen Pink. Amazon.com [amazon.com] hat *Nostalgia Retro Snow Cone Maker – Aufsatz-5-qt-Schneeeismaschine – Edelstahlklingen – Inklusive 2 wiederverwendbaren Bechern, Eisschaufel und seitlicher Ablage – Pink* im Angebot für...","$39.99: Nostalgia Retro Snow Cone Maker Countertop 5-qt Shaved Ice Machine Stainless Steel Blades Pink. Amazon.com [amazon.com] has *Nostalgia Retro Snow Cone Maker – Countertop 5-qt Shaved Ice Machine – Stainless Steel Blades – Includes 2 Reusable Cups, Ice Scoop, & Sid Shelf – Pink* on sale for...","$39.99: Peractorum Retro Nivis Cone Factoris Countertop 5-qt Shaved Ice Machine Diver Laminae Pink. Amazon.com [amazon.com] habet *Desiderium Retro Nivis Coni Factoris - Countertop 5-qt Shaved Ice Machina - Immaculata Ferri Laminae - Includes 2 Cucurbitulae Reusable, Ice Scoope, & Sid Shelf - Pink* de sale for...",2026-07-05 19:55:16+00:00
cd3aaa06efed2108420bfc5caec56c67,2026-07-03T05:49:32Z,'snow',www.lifesciencesworld.com,en,0.9,Do ferrets like the snow?,"Do Ferrets Like the Snow? A Deep Dive into Winter Fun for Fuzzy Companions Ferrets and snow can be a fun combination, but it’s crucial to understand their limitations. Yes, ferrets can enjoy playing in the snow, but extreme caution and proper preparation are …",https://www.lifesciencesworld.com/do-ferrets-like-the-snow/,,,"Do Ferrets Like the Snow? A Deep Dive into Winter Fun for Fuzzy Companions
Ferrets and snow can be a fun combination, but it’s crucial to understand their limitations. Yes, ferrets can enjoy playing… [+7548 chars]",,"Mögen Frettchen den Schnee? Mögen Frettchen den Schnee? Ein tiefer Einblick in den Winterspaß für flauschige Begleiter Frettchen und Schnee können eine lustige Kombination sein, aber es ist wichtig, ihre Grenzen zu verstehen. Ja, Frettchen können gerne im Schnee spielen, aber äußerste Vorsicht und richtige Vorbereitung sind erforderlich …","Do ferrets like the snow?. Do Ferrets Like the Snow? A Deep Dive into Winter Fun for Fuzzy Companions Ferrets and snow can be a fun combination, but it’s crucial to understand their limitations. Yes, ferrets can enjoy playing in the snow, but extreme caution and proper preparation are …","Numquid sicut nix ferrets ?. Numquid Ferrets Nix? A Deep Dive into Winter Fun for Fuzzy Companions Ferrets et nives possunt esse iocum iuncturae, sed limitationes suas intelligere crucialit. Immo galgos in nive ludentes frui possunt, sed summa cautela et praeparatio propria sunt...",2026-07-05 19:55:16+00:00
cabf4fe92a4e144e31d55d04ea3c0ef1,2026-07-03T10:14:21Z,'snow ice',www.channelnewsasia.com,en,0.9,Swiss glaciers rapidly lose protective snow in punishing European heatwave,"OBERGOMS: Snow on Swiss glaciers disappeared weeks earlier than usual this summer under the glare of a European heatwave, pitching the Alps into another year of heavy ice loss, scientists",https://www.channelnewsasia.com/sustainability/swiss-glaciers-rapidly-lose-protective-snow-in-punishing-european-heatwave-6230351,"https://dam.mediacorp.sg/image/upload/s--X5G6SnCd--/c_crop,h_449,w_799,x_1,y_92/c_fill,g_auto,h_676,w_1200/fl_relative,g_south_east,l_mediacorp:cna:watermark:2024-04:reuters_1,w_0.1/f_auto,q_auto/v1/one-cms/core/2026-07-03T094500Z_1_LYNXMPEM620JD_RTROPTP_3_EUROPE-WEATHER-SWISS-GLACIERS.JPG?itok=SvmsEK3i",,"OBERGOMS: Snow on Swiss glaciers disappeared weeks earlier than usual this summer under the glare of a European heatwave, pitching the Alps into another year of heavy ice loss, scientists say.
Resea… [+1446 chars]",,"Schweizer Gletscher verlieren durch die europäische Hitzewelle schnell schützenden Schnee. OBERGOMS: Der Schnee auf den Schweizer Gletschern verschwand diesen Sommer Wochen früher als sonst unter der Einwirkung einer europäischen Hitzewelle, was den Alpen ein weiteres Jahr mit starkem Eisverlust bescherte, so Wissenschaftler","Swiss glaciers rapidly lose protective snow in punishing European heatwave. OBERGOMS: Snow on Swiss glaciers disappeared weeks earlier than usual this summer under the glare of a European heatwave, pitching the Alps into another year of heavy ice loss, scientists","Helvetiae molibus perniciter tutelam nivem amittunt in puniendo heatwave Europaeae. OBERGOMS: Nix in Helvetiis molibus hebdomades evanuerunt ante solito hac aestate sub fulgor caloris Europaei, Alpes in alium annum positis gravibus glaciei amissionis, phisici",2026-07-05 19:55:16+00:00
